fintype	type	index	image	md_path	background_story	information	round	question	A	B	C	D	answer
投资分析	hg	210972	data/figure/hg/2024-07-30--美容护理-百亚股份-公司深度研究：立足大单品策略，电商渠道加速弯道超车_page26_图6520092023年中国吸收性卫生用品网购销售销售收入占比.jpg				2.0	根据第一轮的描述，这张图表显示了哪三种类型的卫生用品？	成人失禁用品、婴儿卫生用品、女性卫生用品	成人失禁用品、儿童卫生用品、女性卫生用品	成人失禁用品、婴儿卫生用品、男性卫生用品	A	
投资分析	hg	210972	data/figure/hg/2024-07-30--美容护理-百亚股份-公司深度研究：立足大单品策略，电商渠道加速弯道超车_page26_图6520092023年中国吸收性卫生用品网购销售销售收入占比.jpg				3.0	从图表中可以看出，哪种类型的卫生用品在2009年至2023年的网购销售收入占比最高？	成人失禁用品	婴儿卫生用品	女性卫生用品	B	
投资分析	hg	210972	data/figure/hg/2024-07-30--美容护理-百亚股份-公司深度研究：立足大单品策略，电商渠道加速弯道超车_page26_图6520092023年中国吸收性卫生用品网购销售销售收入占比.jpg				4.0	结合第四轮的答案，你认为导致婴儿卫生用品网购销售收入占比逐年上升的原因可能是什么？	人口老龄化加剧	新生儿数量增加	女性卫生意识提高	B	
投资分析	hg	210972	data/figure/hg/2024-07-30--美容护理-百亚股份-公司深度研究：立足大单品策略，电商渠道加速弯道超车_page26_图6520092023年中国吸收性卫生用品网购销售销售收入占比.jpg				5.0	根据第五轮的答案，如果预测未来几年新生儿数量继续增加，对婴儿卫生用品的网购销售收入占比会有什么影响？	进一步上升	保持不变	下降	A	
投资分析	hg	211000	data/figure/hg/2024-07-24--物流行业-东航物流-电商出海东风助力，航空物流龙头起飞_page12_图表292024年夏秋中国与部分国家地区周航班量.jpg				2.0	根据图片，哪个国家或地区的航班量最高？以下为选项	日本	韩国	中东地区	A	
投资分析	hg	211000	data/figure/hg/2024-07-24--物流行业-东航物流-电商出海东风助力，航空物流龙头起飞_page12_图表292024年夏秋中国与部分国家地区周航班量.jpg				3.0	如果要分析航空物流行业的发展趋势，你认为哪些因素可能影响这些航班量的变化？以下为选项	经济政策、市场需求、季节性变化	天气状况、飞行员数量、机场设施	燃油价格、航空公司竞争、国际关系	A	
投资分析	hg	211000	data/figure/hg/2024-07-24--物流行业-东航物流-电商出海东风助力，航空物流龙头起飞_page12_图表292024年夏秋中国与部分国家地区周航班量.jpg				4.0	假设你是东航物流的市场分析师，基于这张图表，你会建议公司重点关注哪个市场以扩大业务？以下为选项	日本和韩国	中东地区和俄罗斯	澳大利亚和美国	A	
投资分析	hg	211000	data/figure/hg/2024-07-24--物流行业-东航物流-电商出海东风助力，航空物流龙头起飞_page12_图表292024年夏秋中国与部分国家地区周航班量.jpg				5.0	结合当前全球电商出海的趋势，你认为航空物流行业在未来几年内可能会面临哪些挑战？以下为选项	运输成本上升、环保法规严格、人力资源短缺	技术更新缓慢、客户需求减少、市场竞争加剧	政策变动频繁、基础设施不足、安全标准提高	A	
投资分析	hg	211000	data/figure/hg/2024-07-24--物流行业-东航物流-电商出海东风助力，航空物流龙头起飞_page12_图表292024年夏秋中国与部分国家地区周航班量.jpg				6.0	如果你是一名投资者，看到这张图表后，你会如何评估东航物流的投资价值？以下为选项	关注其在高航班量市场的市场份额和盈利能力	评估其在低航班量市场的潜在增长机会	考虑其在全球范围内的网络布局和资源整合能力	A	
投资分析	hg	211007	data/figure/hg/2024-07-23--橡胶制品-利通科技-利通科技首次覆盖报告：深耕橡胶软管，石油管持续放量_page4_图7公司在建工程情况.jpg				2.0	根据图片，2021年在建工程的金额是多少，以下为选项	3,067.83万元	6,609.13万元	2,721.46万元	B	
投资分析	hg	211007	data/figure/hg/2024-07-23--橡胶制品-利通科技-利通科技首次覆盖报告：深耕橡胶软管，石油管持续放量_page4_图7公司在建工程情况.jpg				3.0	与2020年相比，2021年在建工程金额增加了多少，以下为选项	3,541.30万元	2,541.30万元	3,541.30亿元	A	
投资分析	pg	220273	data/figure/pg/2024-06-17--有色金属-金徽股份-甘肃铅锌龙头，江洛整合值得期待_page8_图表122023年全球锌资源储量占比.jpg,data/figure/pg/2024-07-30--美容护理-百亚股份-公司深度研究：立足大单品策略，电商渠道加速弯道超车_page14_图252023年全球女性卫生用品市场公司竞争格局.jpg,data/figure/pg/2024-06-13--化学制品-硅宝科技-公司拟以现金方式收购江苏嘉好100%股权_page5_评级分布RatingDistribution.jpg				1.0	假设硅宝科技收购江苏嘉好后，其评级分布将如何变化？结合2023年全球锌资源储量和女性卫生用品市场数据进行推理。	优大于市的比例将增加	中性比例将减少	劣于大市的比例将不变	无法确定评级分布的变化	D
投资分析	hg	220419	data/figure/hg/2023-06-02--粤开证券-【粤开宏观】从财税视角看海南：“热带宝地”的财政债务形势_page6_图表42021年海南省一般公共预算收支预算级次构成图.jpg,data/figure/hg/2023-06-02--粤开证券-【粤开宏观】从财税视角看海南：“热带宝地”的财政债务形势_page6_图表3海南省2021年各地市产业结构.jpg,data/figure/hg/2023-06-02--粤开证券-【粤开宏观】从财税视角看海南：“热带宝地”的财政债务形势_page7_图表62020年海南省创造税收收入分税种构成.jpg,data/figure/hg/2023-06-02--粤开证券-【粤开宏观】从财税视角看海南：“热带宝地”的财政债务形势_page7_图表52020年海南省创造的税收收入来源分行业对比.jpg				1.0	根据图表3，海南省2020年创造税收收入中，增值税占比为37.9%，企业所得税占比为20.8%。请问两者之和占总创造税收收入的比例是多少？	58.7%	57.7%	56.7%	55.7%	A
投资分析	hg	220434	data/figure/hg/2023-03-30--国海证券-什么是房地产新的发展模式？_page10_图420032022年各类资产年均收益率.jpg,data/figure/hg/2023-03-30--国海证券-什么是房地产新的发展模式？_page11_图52020年底全国各地城镇家庭户租赁房比重.jpg,data/figure/hg/2023-03-30--国海证券-什么是房地产新的发展模式？_page13_图7国际主要大城市租赁人口比重.jpg,data/figure/hg/2023-03-30--国海证券-什么是房地产新的发展模式？_page13_图6世界各地住房租赁比率.jpg				1.0	根据图2，2020年中国各地城镇家庭户租赁比率最高的省份是广西，比率为57.8%。请问以下哪个选项正确描述了广西与全国其他省份的租赁比率关系？	广西的租赁比率低于全国所有其他省份	广西的租赁比率高于全国所有其他省份	广西的租赁比率与全国其他省份相同	无法确定	B
投资分析	lc	220500	data/figure/lc/2023-07-30--民生证券-宏观事件点评：日央行YCC调整影响_page1_图3日本10年期国债利率.jpg,data/figure/lc/2023-07-30--民生证券-宏观事件点评：日央行YCC调整影响_page1_图2截至2023年5月日本工资收入同比增速.jpg				1.0	根据图1和图2，2023年日本10年期国债利率的最高点出现在哪一年？	2021年	2022年	2023年	2024年	C
投资分析	lc	220507	data/figure/lc/2023-07-28--民生证券-资本新秩序系列（四）：寻找真正的红利_page2_图1全部A股风险溢价的构成对于再投资给予的风险溢价类债风险溢价当下真正便宜的股息率资产.jpg,data/figure/lc/2023-07-28--民生证券-资本新秩序系列（四）：寻找真正的红利_page5_图52016年以来长江电力分红比例稳步提升基本上都在50以上.jpg				1.0	根据图1和图2，哪一年的分红比例最高？	2004年	2005年	2021年	2022年	D
投资分析	lc	220518	data/figure/lc/2023-03-12--山西证券-2023年2月金融数据点评兼论利率影响：新增社融超预期，长端利率难下行_page1_图1M2及社融存量同比增速.jpg,data/figure/lc/2023-03-12--山西证券-2023年2月金融数据点评兼论利率影响：新增社融超预期，长端利率难下行_page1_no_caption.jpg				1.0	根据图1和图2，哪一年企业贷款增速与住户贷款增速的差距最小？	2016年	2017年	2018年	2019年	D
投资分析	lc	220538	data/figure/lc/2023-09-06--联储证券-7月财政数据解读：收支偏慢，财政仍有发力空间_page11_图29政府性基金支出累计同比增速.jpg,data/figure/lc/2023-09-06--联储证券-7月财政数据解读：收支偏慢，财政仍有发力空间_page11_图27政府性基金收入累计同比增速.jpg				1.0	从两张折线图中可以看出，哪一年的政府性基金支出累计同比增速首次出现负增长？	2019年	2020年	2021年	2022年	B
投资分析	frg	220713	data/figure/frg/2024-01-19--美容护理-丸美股份-首次覆盖报告：主品牌蓄力调整可期，恋火打开彩妆第二增长曲线_page20_图27公司线上转型历程.jpg,data/figure/frg/2024-01-19--美容护理-丸美股份-首次覆盖报告：主品牌蓄力调整可期，恋火打开彩妆第二增长曲线_page19_图24公司渠道结构.jpg				1.0	根据2020年至2023年的公司线上转型历程，丸美股份在2021年采取了什么措施？	将‘丸美天猫旗舰店’由第三方代运营调整为自营	自建超200人的电商团队	成立‘内容电商部’、‘平台电商部’、‘会员部’三个板块	设立以天猫为代表的货架电商部、以抖快为代表的自播电商部和达播电商部	A
投资分析	frg	220800	data/figure/frg/2024-02-29--化学制品-永和股份-周期与成长共振的氟化工一体化企业_page30_图表67HFP是多种含氟高分子材料的重要中间体.jpg,data/figure/frg/2024-02-29--化学制品-永和股份-周期与成长共振的氟化工一体化企业_page10_图表13萤石是氟化工产业链的起点.jpg				1.0	根据第一张图，六氟丙烯的主要下游产品中，占比最大的是？	六氟环氧丙烷	氟橡胶	七氟丙烷	聚全氟乙丙烯	B
投资分析	frg	220808	data/figure/frg/2024-07-29--包装材料-英联股份-深度报告：传统主业稳建，复合箔材打造新增长极_page5_公司股权结构.jpg,data/figure/frg/2024-07-29--包装材料-英联股份-深度报告：传统主业稳建，复合箔材打造新增长极_page4_公司发展历程.jpg				1.0	根据第一张图，广东英联包装股份有限公司的最大股东是谁？	翁伟武	柯丽婉	翁伟炜	其他	A
投资分析	frg	220932	data/figure/frg/2024-01-29--汽车整车-比亚迪-升级换代提升产品力，规模优势铸就护城河_page21_图表38公司股权结构.jpg,data/figure/frg/2024-03-03--汽车零部件-溯联股份-尼龙管路迎新机，核心件自制打开成长空间_page3_图1公司发展历程.jpg,data/figure/frg/2024-04-18--电网设备-中熔电气-国内电力熔断器龙头，海外+800V打开增长空间_page5_图2截至2023年12月中熔电气股权结构.jpg				1.0	如果以2024年为基准年，假设所有公司在未来三年内保持相同的增长率，哪家公司的市值增长潜力最大？	比亚迪股份有限公司	溯联股份	中熔电气	无法确定	D
投资分析	frg	220938	data/figure/frg/2024-06-28--农牧饲渔-邦基科技-高端饲料领航者，有望充分受益后周期需求回暖_page17_图表28公司股权结构图截至2024Q1.jpg,data/figure/frg/2024-07-29--包装材料-英联股份-深度报告：传统主业稳建，复合箔材打造新增长极_page39_水平镀设备主要工艺.jpg,data/figure/frg/2024-09-17--化学制品-一诺威-北交所公司深度报告：聚氨酯CPU全国单项冠军，技术+产业链共建竞争优势_page4_图2公司股权结构清晰.jpg				1.0	根据图片内容，如果要计算邦基科技的总股权结构中，除了王由成和其它股东外的持股比例，应该如何计算？	将淄博邦盈、淄博邦智、淄博邦道、淄博邦儒、淄博邦贤、山东邦基集团、青岛永合金丰的持股比例相加	将所有子公司的持股比例相加	将所有子公司的持股比例相加后，再减去王由成和其它股东的持股比例	无法计算，因为缺少关键数据	A
投资分析	frg	220954	data/figure/frg/2024-03-03--汽车零部件-溯联股份-尼龙管路迎新机，核心件自制打开成长空间_page3_图1公司发展历程.jpg,data/figure/frg/2024-07-30--美容护理-百亚股份-公司深度研究：立足大单品策略，电商渠道加速弯道超车_page9_图11公司股权结构截至2024年一季度.jpg,data/figure/frg/2024-01-29--非金属材料-石英股份-公司首次覆盖报告：石英技术行业领先，下游放量成长加速_page5_图2石英股份股权结构.jpg				1.0	如果江苏太平洋石英股份有限公司的股价为10元，且其子公司连云港太平洋金浩石英制品有限公司的股权比例为100%，那么连云港太平洋金浩石英制品有限公司的每股价值是多少？	10元	5元	2元	无法计算	D
投资分析	frg	220976	data/figure/frg/2024-02-19--通用设备-巨星科技-OBM与ODM双轮驱动，领跑国内工具行业全球化布局_page8_图表4巨星科技股权结构.jpg,data/figure/frg/2024-02-07--化学制药-恒瑞医药-公司深度报告：创新药持续兑现，经营步入新周期_page5_图恒瑞医药股权架构稳定截止2023年三季报.jpg,data/figure/frg/2024-06-28--农牧饲渔-邦基科技-高端饲料领航者，有望充分受益后周期需求回暖_page17_图表28公司股权结构图截至2024Q1.jpg,data/figure/frg/2024-09-10--半导体-长电科技-国内龙头平台型封测厂，全球化多品类布局优势显著_page17_图表37收购完成后晟碟半导体股权结构.jpg				1.0	如果要评估这四家公司的市场影响力，以下哪个指标最能反映其在全球市场的布局和合作情况？	子公司的数量	股权结构的复杂性	与国际合作伙伴的合作比例	母公司持股比例	C
投资分析	frg	220985	data/figure/frg/2024-03-11--生物制品-英诺特-呼吸道病原体POCT快检龙头，持续稳健增长可期_page5_图表2公司一致行动人持股比例高.jpg,data/figure/frg/2024-07-04--小金属-宝钛股份-切入“果链”，钛材龙头能否破局？宝钛股份：成本高企，需求见顶，产能过剩，利润原地踏步，现金流承压_page4_来源宝钛股份2023年年报.jpg,data/figure/frg/2024-08-11--电子元件-景旺电子-产品布局多元，全球化战略势能逐步释放_page8_图5公司2023年末景旺电子股东股权结构图.jpg,data/figure/frg/2024-09-27--医疗服务-迈普医学-迈普医学深度报告：深耕神经外科，植入医疗器械领域领跑者_page5_图3股权结构图截至2024年3月31日.jpg				1.0	如果以股东持股比例作为衡量标准，哪家公司在其主要子公司中的控制力最强？	英诺特	宝钛股份	景旺电子	迈普医学	D
投资分析	frg	230223	data/figure/frg/2022-11-30--食品饮料-天味食品-渠道良性稳健发展，产品品牌具备持久动能_page14_图表26天味食品股权结构示意图截至2021年12月31日.jpg		"在2021年12月31日的股权结构示意图中，天味食品展示了其复杂的股权分布和业务布局。邓文以64.67%的持股比例稳居大股东地位，唐璐和唐鸣分别持有10.38%和0.38%的股份，机构持股占比为4.19%，其他股东则持有剩余的20.38%。这种高度集中的股权结构表明了公司管理层对公司的控制力和决策权。

天味食品通过自贡市天味食品有限公司、四川瑞生投资管理公司、有点火科技有限公司和四川航佳生物科技有限公司等子公司进行业务拓展。其中，自贡市天味食品有限公司和四川瑞生投资管理公司各占100%的股份，而有点火科技有限公司和四川航佳生物科技有限公司分别占70%和17.97%的股份。这种多元化的业务布局不仅增强了公司的抗风险能力，还为其提供了更多的增长机会。

从市场环境来看，食品饮料行业在过去几年经历了快速的发展。随着消费者对健康和品质的追求不断提高，天味食品的产品品牌具备持久动能，渠道良性稳健发展。然而，市场竞争也日益激烈，尤其是在高端市场，各大品牌纷纷推出新产品，争夺市场份额。此外，政策变化和技术进步也是影响公司财务表现的重要因素。例如，食品安全法规的严格要求迫使企业加大投入，提高产品质量；而技术进步则为企业提供了新的发展机遇，如电商平台的崛起使得销售渠道更加多元化。

在全球经济形势方面，尽管面临诸多不确定性，但中国经济的持续增长为天味食品提供了稳定的市场需求。同时，全球供应链的不稳定性和原材料价格波动也可能对公司造成一定影响。因此，天味食品需要密切关注宏观经济动态，灵活调整经营策略，以应对各种挑战。

综上所述，天味食品在复杂多变的市场环境中展现了强大的竞争力和发展潜力。通过不断优化产品结构、加强品牌建设、拓展销售渠道，天味食品有望在未来继续保持良好的增长势头。"			天味食品的控股股东是谁？	邓文	唐璐	唐鸣	机构持股	A
投资分析	frg	230224	data/figure/frg/2023-11-29--商业百货-小商品城-小商品、大生意，三大生态系统成形铸高壁垒_page5_图表2公司股权结构截至2023Q3末.jpg		"在2023年11月29日的商业百货和小商品城市场中，浙江中国小商品城集团股份有限公司（以下简称“小商品城”）的股权结构图揭示了其复杂的股东背景和市场环境。从图表中可以看出，小商品城的主要股东包括义乌市市场发展集团有限公司、义乌中国小商品城控股有限责任公司和浙江浙财资本管理有限公司。其中，义乌市市场发展集团有限公司持有87.59%的股份，而义乌中国小商品城控股有限责任公司持有55.38%的股份，浙江浙财资本管理有限公司则持有2.69%的股份。

这一股权结构反映了小商品城在市场中的重要地位和复杂关系。义乌市市场发展集团有限公司作为大股东，不仅拥有强大的资金支持，还具备丰富的市场资源和政府背景。义乌中国小商品城控股有限责任公司则通过其在小商品市场的深耕细作，为小商品城提供了坚实的业务基础。浙江浙财资本管理有限公司的加入，则为小商品城带来了更多的金融资源和投资机会。

从行业动态来看，小商品城所在的市场正处于快速变化之中。随着电商的崛起和技术的进步，传统的小商品市场面临着巨大的挑战和机遇。小商品城通过与各大电商平台的合作，积极拓展线上销售渠道，实现了线上线下融合发展的新模式。同时，小商品城还加大了对新技术的投资力度，通过大数据、云计算等技术手段，提升了供应链管理和客户服务能力。

然而，市场竞争依然激烈。在全球经济形势不确定的情况下，小商品城需要面对来自国内外竞争对手的压力。政策变化也是影响小商品城财务表现的重要因素。近年来，国家出台了一系列支持中小企业发展的政策，为小商品城的发展提供了良好的政策环境。但同时，环保政策的收紧和国际贸易摩擦的加剧，也给小商品城带来了一定的挑战。

总体而言，小商品城凭借其强大的股东背景和市场资源，在激烈的市场竞争中保持了稳健的发展态势。未来，小商品城将继续深化与电商平台的合作，加强技术创新，提升供应链管理水平，以应对市场环境的变化和竞争压力。"			浙江中国小商品城集团股份有限公司的最终控股公司是？	义乌市市场发展集团有限公司	浙江省财政厅	工银金融资产投资有限公司	义乌市人民政府国有资产监督管理办公室	D
投资分析	frg	230249	data/figure/frg/2023-11-16--互联网服务-赛维时代-深度报告：全链路时尚产业跨境电商，品牌化发展未来可期_page6_图8公司股权结构截至202307.jpg		"在2023年11月16日发布的深度报告中，互联网服务行业展现出了蓬勃发展的态势。赛维时代作为全链路时尚产业跨境电商的领军企业，其品牌化发展未来可期。从图表中可以看出，赛维时代的股权结构复杂且多元化，这反映了公司在市场环境、行业动态和经济趋势中的灵活应对策略。

首先，我们注意到陈文平和陈文辉两位创始人分别持有52.502%和99.00%的股份，显示出他们对公司控制权的牢牢把握。这种高度集中的股权结构有助于公司决策的高效执行，但也可能限制了外部资本的进入，影响公司的融资能力和市场扩展速度。此外，君鹏投资、众腾投资等机构投资者也持有一定比例的股份，表明资本市场对赛维时代的认可和支持。

从数据变化趋势来看，赛维时代在过去几年中实现了快速增长。这背后的主要驱动因素包括市场需求的持续增长和技术进步。随着全球消费者对时尚产品需求的增加，跨境电商平台成为连接国内外市场的桥梁。同时，大数据、人工智能等技术的应用使得赛维时代能够更精准地捕捉用户需求，提供个性化服务，从而提升用户体验和忠诚度。

然而，市场环境与竞争格局也在不断变化。宏观经济层面，全球经济形势的不确定性给跨境电商带来了挑战。政策变化如贸易保护主义抬头、关税调整等都可能影响公司的财务表现。此外，市场竞争日益激烈，新兴电商平台不断涌现，对赛维时代构成了威胁。因此，公司需要不断创新和优化供应链管理，以保持竞争优势。

综上所述，赛维时代在复杂的市场环境中展现了强大的适应能力和增长潜力。通过深入分析数据背后的逻辑关系，我们可以预见，在未来的品牌化发展中，赛维时代有望继续引领时尚产业跨境电商领域的发展潮流。"			赛维时代的主要股东是谁？	陈文平	陈文辉	君鹏投资	众腾投资	A
投资分析	frg	230251	data/figure/frg/2023-02-06--商业百货-王府井-零售巨头，免税启航_page20_图表36新世界股权结构截至2021年12月31日.jpg		"在2021年12月31日，韩国零售巨头新世界（Shinsegae）的股权结构显示了其独特的市场环境和行业动态。根据图表，Chung, Yoo Kyung持有18.56%的股份，成为最大的单一股东；其次是国家养老金服务（National Pension Service），持有12.71%的股份；Lee, Myung Hee持有10.00%的股份；其他股东则共同持有剩余的58.73%。

这一股权结构反映了新世界在韩国零售市场的稳固地位。Chung, Yoo Kyung作为三星集团创始人李秉哲的女儿，不仅继承了家族的商业遗产，还通过自身的努力和战略眼光，成功地将新世界打造成为韩国零售业的领军企业。她的持股比例表明她在公司决策中的重要影响力。与此同时，国家养老金服务的持股也显示出政府对新世界的重视和支持，这为公司在政策层面提供了稳定的保障。

然而，值得注意的是，其他股东持有的58.73%股份表明新世界的股权相对分散，这可能会影响公司的决策效率和稳定性。此外，随着市场竞争的加剧和技术进步的推动，新世界需要不断创新和调整策略以保持竞争优势。例如，近年来电子商务的快速发展对传统零售业构成了巨大挑战，新世界必须加快数字化转型，提升线上销售能力，以应对市场需求的变化。

在全球经济形势不确定的情况下，外部因素也可能对新世界的财务表现产生影响。例如，政策变化、市场竞争加剧以及全球经济形势的波动都可能对公司业绩造成冲击。因此，新世界需要密切关注宏观经济环境，灵活调整经营策略，以应对潜在的风险和挑战。

总体而言，新世界的股权结构反映了其在韩国零售市场的领先地位，但也面临着来自市场环境和技术进步的压力。通过不断创新和适应变化，新世界有望继续保持其在行业中的竞争优势，并实现可持续发展。"			根据图表，SHINSEGAE的最大股东是谁？	Chung, Yoo Kyung	National Pension Service	Lee, Myung Hee	其他股东	A
