fintype	type	index	image	md_path	background_story	information	round	question	A	B	C	D	answer
投资分析	frg	230294	data/figure/frg/2023-12-05--专业服务-普蕊斯-乘行业东风快速成长的SMO领军企业_page5_图表2公司股权架构更新至2023年三季报.jpg		"在2023年12月5日，普蕊斯（上海）医药科技开发股份有限公司发布了一份最新的股权架构图，展示了公司在快速成长的SMO（Site Management Organization）行业中的领先地位。图表显示，曾桂英和赖春宝夫妇通过一致行动关系，共同持有公司80%的股份，其中曾桂英直接持有20%，并通过石河子玺泰间接持有98%，而赖春宝则通过石河子睿新间接持有86.29%的GP份额。这种高度集中的股权结构表明了公司管理层对业务发展的坚定信心和控制力。

值得注意的是，观由昭泰、石河子睿泽盛和其他股东分别持有5.58%、7.36%和52.54%的股份。这种多元化的股东结构不仅增强了公司的财务稳定性，还为未来的资本运作提供了更大的灵活性。此外，普蕊斯杭州、蕊心（赣州）和铨融（上海）三家子公司分别持有100%、100%和11.93%的股份，进一步巩固了公司在医药科技领域的市场地位。

从行业动态来看，SMO行业正处于快速发展阶段，市场需求旺盛。随着全球医药研发成本的不断攀升，越来越多的制药企业开始寻求专业的SMO服务来提高研发效率和降低成本。普蕊斯作为行业的领军企业，凭借其强大的技术实力和丰富的项目管理经验，成功抓住了这一市场机遇，实现了快速增长。

然而，市场竞争也在加剧。随着更多新进入者的加入，普蕊斯需要不断创新和提升服务质量，以保持其竞争优势。同时，政策环境的变化也可能对公司产生影响。例如，政府对医药行业的监管政策可能会发生变化，这将直接影响到公司的业务模式和盈利水平。因此，普蕊斯需要密切关注政策动向，及时调整战略，以应对潜在的风险。

在全球经济形势方面，尽管存在一些不确定因素，但整体上仍保持稳定增长的趋势。这对于普蕊斯来说是一个利好消息，因为稳定的宏观经济环境有利于公司持续发展。未来，普蕊斯将继续加强与国内外合作伙伴的合作，拓展国际市场，进一步巩固其在全球SMO行业的领先地位。"			普蕊斯（上海）医药科技开发股份有限公司的股东中，持股比例最高的股东是？	曾桂英	赖春宝	杨宏伟	其他	D
投资分析	frg	230351	data/figure/frg/2022-11-18--电力行业-华电国际-新型电力系统下火电支撑性电源价值重估，容量电价变革火电电价机制_page11_图6公司股权结构截止到2022年9月30日.jpg		"在2022年11月18日的电力行业报告中，华电国际作为新型电力系统下的火电支撑性电源，其价值重估和容量电价变革成为市场关注的焦点。图表显示，截至2022年9月30日，华电国际的股权结构呈现出多元化的特点，这背后反映了电力行业的复杂性和市场竞争的激烈程度。

首先，从股权结构来看，中国华电集团有限公司持有华电国际45.94%的股份，是最大的股东。这一高比例的持股不仅体现了国家对电力行业的重视和支持，也意味着华电国际在政策层面具有一定的优势。此外，国务院国有资产监督管理委员会通过中国华电集团间接持有华电国际的股份，进一步巩固了国家对公司的控制力。然而，值得注意的是，其他股东合计持有23.44%的股份，显示出市场的多元化和竞争的加剧。其中，香港中央结算（代理人）有限公司持有18.37%的股份，表明外资对华电国际的兴趣和信心。

从市场环境来看，电力行业正经历着前所未有的变革。随着新能源技术的进步和环保政策的推动，传统火电企业面临着巨大的转型压力。华电国际作为火电支撑性电源，其价值重估不仅是对自身业务模式的重新评估，更是对整个电力行业未来发展方向的思考。容量电价变革则是这一背景下的一项重要措施，旨在通过价格机制引导电力资源的合理配置，提高能源利用效率。

分析数据的变化趋势，可以发现市场需求和技术进步是驱动因素。随着全球对清洁能源的需求日益增长，电力行业正在加速向绿色低碳转型。华电国际作为传统火电企业，必须积极应对这一变化，通过技术创新和业务转型来适应新的市场环境。同时，政策变化也是不可忽视的因素。近年来，中国政府出台了一系列支持新能源发展的政策，这对华电国际等传统火电企业提出了更高的要求。

在全球经济形势不确定的情况下，市场竞争更加激烈。华电国际不仅要面对国内同行的竞争，还要应对来自国际市场的挑战。因此，公司需要不断优化自身的财务表现，提升核心竞争力。总体而言，华电国际在当前市场环境下，既要抓住政策机遇，又要应对市场挑战，才能实现可持续发展。"			华电国际电力股份有限公司的最大股东是谁？	中国华电集团有限公司	香港中央结算（代理人）有限公司	山东发展投资控股集团有限公司	其他股东	A
投资分析	frg	230379	data/figure/frg/2023-06-29--装修装饰-华凯易佰-跨境电商龙头再迎数字化腾飞_page10_图表14公司股权结构图截至2023年一季报.jpg		"在2023年6月29日的市场分析报告中，华凯易佰科技股份有限公司（以下简称“华凯易佰”）的股权结构图揭示了其复杂的股东关系和业务布局。作为一家专注于装修装饰和跨境电商的企业，华凯易佰在过去几年中经历了快速的发展和转型。

从股权结构图中可以看出，华凯易佰的主要股东包括胡范金、庄俊超、周新华等个人投资者，以及多家投资公司。其中，胡范金通过芒励多股权投资合伙企业持有10.35%的股份，庄俊超通过超然迈伦股权投资合伙企业持有7.69%的股份。此外，周新华夫妇通过神来科技持有4.15%的股份，而罗晔则通过易创辉煌股权投资合伙企业持有5.72%的股份。值得注意的是，2022年员工持股计划也持有2.77%的股份，这表明公司在激励员工方面采取了积极措施。

华凯易佰的核心业务分为两大部分：上海华凯（空间环境艺术设计）和易佰网络（跨境出口电商）。上海华凯负责室内设计和装修装饰业务，而易佰网络则专注于跨境电商平台的运营。这种双轮驱动的业务模式使得华凯易佰能够在不同的市场环境中灵活应对挑战。

从行业动态来看，近年来跨境电商行业蓬勃发展，尤其是在数字化转型的推动下，越来越多的企业开始涉足这一领域。华凯易佰凭借其强大的技术实力和丰富的市场经验，在跨境电商领域取得了显著的成绩。同时，随着消费者对个性化和高品质家居装饰需求的增加，装修装饰行业也迎来了新的发展机遇。

然而，市场竞争激烈，政策变化频繁，全球经济形势不稳定等因素都可能对公司财务表现产生影响。例如，中美贸易摩擦可能会导致跨境电商平台的运营成本上升，进而影响公司的盈利能力。此外，房地产市场的波动也会对装修装饰业务造成一定冲击。

总体而言，华凯易佰在复杂多变的市场环境中展现出了强大的适应能力和创新能力。通过不断优化股权结构，加强内部管理，提升技术水平，华凯易佰有望在未来继续保持稳健增长，并为股东创造更多价值。"			华凯易佰科技股份有限公司的直接股东中，持股比例最高的股东是？	周新华	罗晔	神来科技	易创辉煌股权投资合伙企业	B
投资分析	frg	230400	data/figure/frg/2023-02-13--中药-昆药集团-公司首次覆盖报告：看好华润入主，赋能昆药打造精品国药_page3_图1公司股权结构据公司2022年半年报统计.jpg		"在2023年2月13日发布的中药-昆药集团首次覆盖报告中，我们可以看到华润医药控股有限公司和香港中央结算有限公司分别持有昆药集团股份的17.64%和4.78%，而其他股东则占据了剩余的股份。这一股权结构显示了华润医药对昆药集团的深度参与和支持，同时也反映了市场对于昆药集团未来发展的高度关注。

从图中可以看出，昆药集团的主要子公司包括海南天禾健康产业有限公司、昆药集团健康服务有限公司、云南昆药生活服务有限公司等。这些子公司涵盖了健康产品、医疗服务等多个领域，显示出昆药集团在中医药领域的多元化布局。其中，昆药集团健康服务有限公司和云南昆药生活服务有限公司均实现了100%的控股，这表明昆药集团在这些领域的控制力和影响力非常强。

进一步分析昆药集团的股权结构，可以发现其背后隐藏着丰富的市场环境和行业动态。首先，随着消费者对健康需求的日益增长，中医药市场迎来了前所未有的发展机遇。昆药集团作为行业内的领军企业，通过不断拓展业务范围和服务领域，成功抓住了这一市场机遇。其次，技术进步也为昆药集团的发展提供了强大动力。近年来，随着生物技术和信息技术的快速发展，中医药行业的研发能力和生产效率得到了显著提升。昆药集团正是借助这些先进技术，不断提升自身竞争力，在激烈的市场竞争中脱颖而出。

然而，昆药集团也面临着一些外部挑战。一方面，政策变化可能对其财务表现产生影响。例如，国家对中医药行业的监管政策可能会发生变化，从而影响到企业的运营成本和利润水平。另一方面，全球经济形势的不确定性也可能给昆药集团带来风险。在全球经济放缓的大背景下，消费者购买力下降，可能会导致市场需求减少，进而影响到公司的销售收入和盈利能力。

综上所述，昆药集团凭借其强大的股东背景、多元化的业务布局以及先进的技术优势，在中医药市场中取得了显著成就。但同时也要注意应对政策变化、市场竞争加剧等外部因素带来的挑战。"			图中昆药集团股份有限公司的直接股东有哪些？	华润三九医药股份有限公司、云南合和（集团）股份有限公司、工银瑞信前沿医疗股票型证券投资基金公司、华立医药集团有限公司	华润医药控股有限公司、香港中央结算有限公司、其他	海南天禾健康产业有限公司、昆药集团健康服务有限公司、云南昆药生活服务有限公司、西双版纳版纳药业有限责任公司、昆明中药厂有限公司	华立集团股份有限公司、其他	A
投资分析	hg	231390	data/figure/hg/2023-09-20--国金证券-大类资产周报第9期：美国企业债违约，需要担忧吗？_page12_图表45当周人民币兑美元英镑和欧元升值.jpg		"2023年9月20日，国金证券发布了一份大类资产周报，其中第9期的图表45显示了当周人民币兑美元、英镑和欧元的汇率变化情况。图表中，美元兑人民币汇率下降了0.89%，欧元兑人民币汇率下降了1.29%，日元兑人民币汇率下降了1.19%，而英镑兑人民币汇率下降幅度最大，达到了1.50%。

这些数据背后反映了当前复杂的市场环境和经济趋势。首先，美元兑人民币汇率的下降表明了美元在全球市场的相对疲软。这可能是由于美国企业债违约风险上升，导致投资者对美元资产的信心减弱。同时，美联储的加息政策也逐渐接近尾声，市场预期未来利率将趋于稳定，这进一步削弱了美元的吸引力。

欧元兑人民币汇率的下降则反映了欧洲经济面临的挑战。欧洲央行持续加息以应对高通胀，但这也给经济增长带来了压力。此外，能源危机和地缘政治紧张局势也加剧了欧洲经济的不确定性，导致欧元在国际市场上表现疲软。

日元兑人民币汇率的下降则与日本经济的低迷有关。日本央行坚持宽松货币政策，导致日元贬值。同时，全球需求放缓和供应链中断也影响了日本的出口，进一步拖累了日元的表现。

英镑兑人民币汇率的大幅下降则反映了英国经济的困境。英国政府的财政政策调整引发了市场动荡，投资者对英国经济前景的担忧加剧。此外，脱欧后的贸易摩擦和全球经济放缓也对英镑造成了压力。

总体来看，这些汇率变化反映了全球经济的复杂性和不确定性。各国央行的货币政策差异、地缘政治风险以及全球经济形势的变化都在影响着货币市场的走势。对于企业和投资者而言，需要密切关注这些外部因素，及时调整策略以应对市场波动。"			哪种货币兑人民币的贬值幅度最小？	美元	欧元	日元	英镑	A
