fintype	type	index	image	md_path	background_story	information	round	question	A	B	C	D	answer
财务指标分析	sdt	220059	data/figure/sdt/2022-11-11--生物制品-毕得医药-公司首次覆盖报告：聚焦新药研发前端，服务全球客户_page18_表9与可比公司相比估值具有性价比.jpg,data/figure/sdt/2022-11-11--生物制品-毕得医药-公司首次覆盖报告：聚焦新药研发前端，服务全球客户_page15_表7对头部客户的依赖度逐渐降低.jpg				3.0	根据表格1.png和表格2.png，以下为问题.2021年FluorochemLimited在第二大客户中的占比是多少?	9.08%	6.69%	3.39%	3.16%	A
财务指标分析	sdt	220059	data/figure/sdt/2022-11-11--生物制品-毕得医药-公司首次覆盖报告：聚焦新药研发前端，服务全球客户_page18_表9与可比公司相比估值具有性价比.jpg,data/figure/sdt/2022-11-11--生物制品-毕得医药-公司首次覆盖报告：聚焦新药研发前端，服务全球客户_page15_表7对头部客户的依赖度逐渐降低.jpg				4.0	根据表格1.png和表格2.png，以下为问题.2022年FluorochemLimited在第二大客户中的占比是多少?	9.08%	6.69%	3.39%	3.16%	B
财务指标分析	sdt	220059	data/figure/sdt/2022-11-11--生物制品-毕得医药-公司首次覆盖报告：聚焦新药研发前端，服务全球客户_page18_表9与可比公司相比估值具有性价比.jpg,data/figure/sdt/2022-11-11--生物制品-毕得医药-公司首次覆盖报告：聚焦新药研发前端，服务全球客户_page15_表7对头部客户的依赖度逐渐降低.jpg				5.0	根据表格1.png和表格2.png，以下为问题.2021年泰坦科技的PE（倍）是多少?	66.52	44.73	31.90	27.05	C
财务指标分析	pg	220279	data/figure/pg/2024-09-17--化学制品-一诺威-北交所公司深度报告：聚氨酯CPU全国单项冠军，技术+产业链共建竞争优势_page19_图162021年中国弹性体消费量在聚氨酯制品比重20.jpg,data/figure/pg/2024-06-03--船舶制造-中国船舶-船舶周期持续向上，中国船舶再创辉煌_page15_no_caption.jpg,data/figure/pg/2024-06-24--中药-葵花药业-品牌构筑核心壁垒，“六五”规划开启百亿目标_page7_图52023年公司各业务收入占比.jpg,data/figure/pg/2024-05-22--光伏设备-阳光电源-光储双轮驱动，龙头昂扬奋发_page21_图表51全球主要户储市场竞争格局.jpg				1.0	假设葵花药业的品牌构筑核心壁垒计划开启百亿目标，如果其化学药业务收入占比为23.85%，且中药业务收入占比为72.71%，那么营养保健品和其他业务收入占比之和为多少？	3.18%	0.26%	3.44%	3.44%	C
财务指标分析	hg	220328	data/figure/hg/2024-02-01--中诚信国际-2023年宏观经济及大类资产配置分析与2024年展望：2024年中国经济：稳与进、破与立中寻求再平衡_page24_图41消极情况下2024年出口同比或仅为1.jpg,data/figure/hg/2024-02-01--中诚信国际-2023年宏观经济及大类资产配置分析与2024年展望：2024年中国经济：稳与进、破与立中寻求再平衡_page24_no_caption.jpg				1.0	根据图1和图2，哪一年的出口同比和房地产投资同比均为负值？	2022年	2023年	2024年（消极情形）	2021年	C
财务指标分析	hg	220458	data/figure/hg/2023-10-25--中国银河-9月财政数据分析：收入印证复苏，支出持续加力_page2_图2公共财政收入完成进度.jpg,data/figure/hg/2023-10-25--中国银河-9月财政数据分析：收入印证复苏，支出持续加力_page3_图5公共财政支出完成进度.jpg,data/figure/hg/2023-10-25--中国银河-9月财政数据分析：收入印证复苏，支出持续加力_page4_图8财政分项支出同比增速9月边际变化.jpg,data/figure/hg/2023-10-25--中国银河-9月财政数据分析：收入印证复苏，支出持续加力_page5_图9政府性基金收入完成进度.jpg				1.0	根据图4，2023年9月与2023年8月相比，节能环保领域的支出同比增速变化了多少百分点？	增加了5个百分点	减少了5个百分点	增加了10个百分点	减少了10个百分点	B
财务指标分析	lc	220652	data/figure/lc/2023-12-25--中泰证券-高频数据观察：开工率整体下跌_page1_图表2煤炭库存百万吨.jpg,data/figure/lc/2023-12-25--中泰证券-高频数据观察：开工率整体下跌_page3_图表6100大中城市土地成交面积万平方米.jpg,data/figure/lc/2023-12-25--中泰证券-高频数据观察：开工率整体下跌_page3_图表530大中城市商品房成交面积万平方米.jpg,data/figure/lc/2023-12-25--中泰证券-高频数据观察：开工率整体下跌_page4_图表8乘用车当周日均销量同比4WMA.jpg				1.0	在2023年1月至10月期间，哪个城市的土地成交面积波动最大？	一线城市	二线城市	三线城市	无法确定	C
财务指标分析	pg	230570	data/figure/pg/2023-07-27--半导体-长光华芯-激光芯片行业领军，平台化能力多领域开拓_page9_图6公司2022年营收拆分情况占比.jpg		"在2023年7月27日，长光华芯作为半导体激光芯片行业的领军企业，发布了一份详尽的2022年营收拆分情况占比报告。这份报告揭示了公司在过去一年中的业务结构和市场表现，为投资者和分析师提供了宝贵的洞察。

从图表中可以看出，高功率单管系列占据了公司总营收的89.54%，成为公司的核心产品线。这一数据背后反映了市场需求的变化和技术进步的驱动因素。随着激光技术在工业、医疗、通信等领域的广泛应用，对高功率激光芯片的需求持续增长。长光华芯凭借其在高功率单管系列的技术优势，成功抓住了这一市场机遇，实现了显著的营收增长。

然而，值得注意的是，高功率VCSEL系列和高功率巴条系列分别仅占1.02%和7.78%的市场份额。这表明公司在这些细分市场的竞争力相对较弱。尽管如此，长光华芯并没有忽视这些领域的发展潜力。通过平台化能力的多领域开拓，公司正在积极布局这些新兴市场，以期在未来实现更广泛的市场覆盖和多元化的产品组合。

除了内部因素外，外部环境也对公司财务表现产生了重要影响。全球经济形势的不确定性、政策变化以及市场竞争加剧等因素都可能对公司未来的业绩产生影响。例如，全球供应链的紧张局势可能导致原材料成本上升，进而影响公司的利润率。此外，政策变化也可能对公司的市场准入和运营模式产生影响。因此，长光华芯需要密切关注宏观经济环境的变化，并采取相应的策略来应对潜在的风险和挑战。

总体而言，长光华芯在2022年的表现令人瞩目，尤其是在高功率单管系列方面取得了显著的成绩。然而，公司也需要继续加强在其他细分市场的竞争力，并密切关注外部环境的变化，以确保长期的可持续发展。"			根据图中数据，以下哪项描述最符合2022年公司营收拆分情况？	高功率单管系列占主导地位	其他业务占比最高	高功率VCSEL系列和高功率巴条系列占比相当	高功率单管系列占比不到50%	A
财务指标分析	pg	230597	data/figure/pg/2024-02-27--电力行业-中国广核-全国核电龙头，业绩持续增长的现金“牛”_page12_图20中国核电电力行业营业成本构成.jpg		"在一个风和日丽的下午，金融分析师李明坐在办公室里，仔细研究着中国核电电力行业的最新数据。他面前的饼图清晰地展示了2021年2月27日中国广核集团的营业成本构成。图表显示，固定资产折旧占据了最大的份额，达到了38%，这表明公司在过去几年中进行了大量的资本投资，以扩大产能和提高效率。紧随其后的是燃料及其他材料成本，占比22%，显示出能源成本在运营中的重要性。电厂运行维护费和人员费用分别占13%，而其他成本则占14%。

李明知道，这些数据背后隐藏着丰富的市场环境和行业动态。首先，固定资产折旧的高比例反映了中国核电行业在过去几年中的快速发展和技术进步。随着国家对清洁能源的重视，核电作为重要的清洁能源之一，得到了政府的大力支持。政策鼓励下，各大核电企业纷纷加大投资力度，建设新的核电站，提升现有设施的效率。然而，这种大规模的投资也带来了高昂的折旧成本，成为公司财务报表上的一大负担。

其次，燃料及其他材料成本的占比虽然相对较低，但依然不容忽视。核电站的运行需要大量的铀燃料和其他辅助材料，这些成本会随着国际市场的波动而变化。近年来，全球能源市场动荡不安，铀价波动频繁，给核电企业的运营带来了一定的不确定性。

此外，电厂运行维护费和人员费用的占比也值得关注。核电站的运行维护是一项复杂且技术要求极高的工作，需要大量专业人才的支持。随着市场竞争的加剧，企业不得不投入更多资源来吸引和留住优秀人才，从而推高了人力成本。同时，为了确保核电站的安全稳定运行，企业还需要定期进行设备检修和维护，这也增加了运营成本。

最后，其他成本的占比虽然不高，但涵盖了各种杂项支出，如保险、税费等，这些成本同样会对公司的财务表现产生影响。

综合来看，中国核电电力行业面临着复杂的市场环境和竞争格局。一方面，政策支持和技术进步为行业发展提供了强劲动力；另一方面，高昂的折旧成本、波动的燃料价格以及不断上升的人力成本，都对公司财务表现构成了挑战。在全球经济形势不确定的情况下，如何在保证安全的前提下，有效控制成本，提高运营效率，将成为中国核电企业未来发展的关键。"			根据图中的营业成本构成，哪种成本占比最高？	固定资产折旧	燃料及其他材料成本	电厂运行维护费	人员费用	A
财务指标分析	pg	230608	data/figure/pg/2024-01-03--电网设备-球冠电缆-北交所首次覆盖报告：电线电缆“小巨人”，装备技改、高压领域布局赋能“两网”业务_page16_图28我国电线电缆行业市场集中度低.jpg		"在2024年初，电网设备行业迎来了一次重要的市场分析报告。这份报告详细展示了电线电缆行业的市场集中度情况，揭示了该行业内的竞争格局和未来趋势。根据图表显示，宝胜股份占据了3.65%的市场份额，远东股份和起帆电缆分别占据了1.65%和1.64%的市场份额，而其他公司则占据了93.06%的市场份额。

这一数据背后反映了电线电缆行业的市场环境和行业动态。首先，电线电缆行业是一个高度分散的市场，没有一家公司能够占据绝对的主导地位。这表明市场竞争激烈，各家公司都在努力提升自己的市场份额。其次，宝胜股份作为行业内的“小巨人”，凭借其在装备技改和高压领域的布局，成功地提高了自己的市场份额。这表明技术进步和产品创新是推动公司发展的关键因素。

从数据的变化趋势来看，电线电缆行业的市场需求正在稳步增长。随着全球能源转型和基础设施建设的推进，电线电缆的需求量也在不断增加。同时，技术进步也在推动行业的发展。例如，高压电缆和智能电缆等新技术的应用，不仅提高了产品的性能，也满足了客户对高质量、高可靠性的需求。这些因素共同推动了电线电缆行业的发展。

然而，电线电缆行业也面临着一些外部因素的影响。政策变化是其中之一。政府对能源转型和基础设施建设的支持政策，为电线电缆行业提供了良好的发展机遇。但同时，政策的变化也可能带来不确定性，影响公司的财务表现。此外，全球经济形势也是一个重要因素。全球经济的波动可能会影响电线电缆行业的需求和价格，从而影响公司的盈利能力。

综上所述，电线电缆行业是一个充满机遇和挑战的市场。宝胜股份等公司在技术进步和产品创新方面的努力，为其赢得了市场份额。然而，政策变化和全球经济形势等外部因素也需要密切关注，以应对未来的挑战。"			如果宝胜股份的市场份额增加2个百分点，其新份额是多少？	5.65%	4.65%	3.85%	3.45%	A
财务指标分析	fs	230794	data/figure/fs/2024-08-20--酿酒行业-燕京啤酒-2024年半年报点评：H1量价齐升，扣非利润高增_page1_公司财务报表数据预测汇总.jpg		"在2023年，燕京啤酒公司迎来了一个充满挑战与机遇的市场环境。根据财务报表数据预测汇总表显示，公司的营业总收入预计从2023年的14,213百万元增长到2026年的16,912百万元，这表明公司在未来几年内将保持稳定的增长态势。然而，这一增长并非一帆风顺，背后隐藏着复杂的市场环境和行业动态。

首先，市场需求是推动公司收入增长的主要因素之一。随着消费者对高品质啤酒的需求不断增加，燕京啤酒通过提升产品质量和品牌影响力来满足这一需求。此外，技术进步也为公司带来了新的发展机遇。例如，自动化生产线的引入不仅提高了生产效率，还降低了成本，从而提升了公司的盈利能力。这些变化反映在财务报表中，EBIT（息税前利润）从2023年的790百万元增长到2026年的2,301百万元，显示出公司在运营效率上的显著提升。

然而，市场竞争激烈也是不可忽视的因素。尽管燕京啤酒在市场上占据了一定份额，但面对其他大型啤酒制造商的竞争压力，公司需要不断创新以保持竞争优势。此外，政策变化也可能对公司产生影响。例如，政府对环保要求的提高可能会增加公司的运营成本，而全球经济形势的不确定性也可能影响消费者的购买力。

为了应对这些挑战，燕京啤酒采取了一系列措施。一方面，公司加大了研发投入，不断推出新产品以满足市场需求；另一方面，公司加强了供应链管理，通过优化库存管理和物流配送来降低成本。这些努力反映在资产负债表中，固定资产从2023年的7,664百万元增长到2026年的7,936百万元，显示出公司在基础设施建设上的持续投入。

总体而言，燕京啤酒在未来的几年里面临着复杂多变的市场环境。虽然存在诸多挑战，但通过不断创新和优化管理，公司有望实现持续增长，并在竞争激烈的市场中保持领先地位。"			2024E 年的 EBIT 比 2023A 年增加了多少？	546 百万元	597 百万元	648 百万元	699 百万元	A
财务指标分析	fs	230818	data/figure/fs/2024-07-18--农牧饲渔-佩蒂股份-代工恢复+品牌快增，盈利改善持续兑现_page1_.jpg		"在一个充满挑战与机遇的市场环境中，一家名为佩蒂股份的公司正经历着从低谷到复苏的转变。2023年，佩蒂股份的财务报表显示，公司在货币资金、应收账款及预付款项等方面均有所下降，这反映了公司在过去一年中面临的经营压力和市场环境的不确定性。然而，随着市场需求的逐步恢复和技术进步的推动，公司的财务状况在2024年开始出现明显好转。

从资产负债表来看，2023年公司的总资产为2936百万元，其中流动资产占比较大，表明公司具有较强的短期偿债能力。然而，非流动资产的增加也显示出公司在固定资产和长期股权投资方面的投入。到了2024年，总资产增长至3053百万元，这主要得益于营业收入的增长和成本控制的有效实施。同时，公司的负债总额也有所上升，但负债率保持在合理范围内，显示出公司良好的财务健康状况。

利润表显示，2023年公司的净利润为-11百万元，这主要是由于营业成本的增加和销售费用的上升所致。然而，随着市场需求的回暖和技术进步带来的生产效率提升，2024年公司的净利润迅速反弹至177百万元，并在随后几年持续增长。这不仅反映了公司内部管理的改善，也体现了外部市场环境的积极变化。

现金流量表进一步揭示了公司现金流的变化趋势。2023年，经营活动产生的现金流量净额为178百万元，而投资活动和筹资活动则分别消耗了154百万元和50百万元。这意味着公司在扩大生产和研发方面进行了大量投资。到了2024年，经营活动产生的现金流量净额大幅增加至246百万元，显示出公司主营业务的强劲增长势头。

结合宏观经济和行业背景，可以发现全球经济形势的改善和政策支持是驱动佩蒂股份业绩增长的重要因素。在全球经济复苏的大背景下，市场需求逐渐回暖，为公司提供了广阔的市场空间。同时，政府对相关行业的扶持政策也为公司的发展创造了有利条件。此外，市场竞争的加剧也促使公司不断优化产品结构和提高服务质量，从而在激烈的竞争中脱颖而出。

综上所述，佩蒂股份通过有效的内部管理和外部环境的积极变化，成功实现了从低谷到复苏的转变。未来，随着市场需求的持续增长和技术进步的不断推进，公司有望继续保持良好的发展势头，为股东创造更多价值。"			2023年至2026年期间，净利润在哪一年达到最大值？	2023年	2024年	2025年	2026年	D
财务指标分析	fs	230859	data/figure/fs/2024-05-27--纺织服装-华利集团-Deckers增长强劲、VF逐步复苏推动订单增长_page2_财务预测摘要.jpg		"在2021年5月27日，纺织服装行业迎来了一个重要的转折点。华利集团和Deckers的增长势头强劲，而VF公司也在逐步复苏，推动订单增长。从财务预测摘要中可以看出，这些公司的货币资金、应收账款及预付款项等流动资产在2022年至2026年间稳步增长，显示出市场对纺织服装产品的需求持续增加。

具体来看，华利集团的营业收入从2022年的205.69亿元增长到2026年的31.03亿元，复合年增长率达到了惊人的14.8%。这背后的主要驱动因素是消费者对高品质服装的需求增加，以及公司在全球市场的扩张策略。同时，Deckers的营业收入也从2022年的201.13亿元增长到2026年的31.03亿元，复合年增长率达到了14.6%。这表明，随着消费者对户外运动和休闲服装的兴趣提升，Deckers的产品线得到了广泛认可。

然而，尽管市场需求旺盛，但纺织服装行业的竞争依然激烈。以华利集团为例，其营业成本从2022年的152.50亿元增长到2026年的22.73亿元，复合年增长率为14.5%。这意味着原材料价格的上涨和劳动力成本的增加正在侵蚀公司的利润空间。此外，华利集团的研发费用从2022年的290.86亿元增长到2026年的496.51亿元，复合年增长率为15.2%。这表明，为了保持竞争优势，公司必须不断投入研发，开发新产品和技术。

在全球经济形势不确定的情况下，政策变化和市场竞争对公司财务表现的影响不容忽视。例如，中美贸易摩擦导致的关税增加可能会对纺织服装出口造成不利影响。此外，随着环保意识的提高，消费者对可持续时尚的需求也在增加，这要求公司采取更加环保的生产方式，从而增加了成本压力。

综上所述，虽然纺织服装行业面临着诸多挑战，但通过不断创新和适应市场变化，华利集团和Deckers等公司仍然能够实现稳健增长。未来几年，随着全球经济的复苏和消费者信心的恢复，纺织服装行业有望迎来更加光明的前景。"			2026E 年的总资产是多少？	27,473.78 百万元	25,540.52 百万元	22,086.21 百万元	19,128.73 百万元	A
财务指标分析	fs	230883	data/figure/fs/2024-04-30--文化传媒-万达电影-公司2023年报暨2024一季报点评：票房收入复苏明显，影剧游内容储备丰富_page1_一公司财务预测表.jpg		"在2023年，万达电影的财务报表显示了公司在过去几年中的显著增长。资产负债表显示，公司的总资产从2023年的2512.53亿元增加到2026年的3495.78亿元，这表明公司在不断扩大其业务规模和投资。流动资产从2023年的757.89亿元增加到2026年的2072.61亿元，显示出公司现金流的强劲增长。非流动资产也从2023年的1754.64亿元增加到2026年的1423.14亿元，这表明公司在固定资产、长期投资和其他非流动资产方面的投入也在不断增加。

利润表显示，公司的营业收入从2023年的1461.97亿元增加到2026年的1928.13亿元，营业成本从2023年的1057.13亿元增加到2026年的1392.77亿元。虽然营业成本有所增加，但净利润从2023年的932.34亿元增加到2026年的1982.26亿元，显示出公司在控制成本和提高盈利能力方面取得了显著成效。此外，公司的营业税及附加、管理费用、财务费用等各项费用也有所增加，但总体上对公司利润的影响较小。

现金流量表显示，公司的经营活动现金流入从2023年的4423.29亿元增加到2026年的3779.78亿元，显示出公司在经营活动中的现金流状况良好。投资活动现金流出从2023年的-557.05亿元减少到2026年的-236.42亿元，显示出公司在投资活动中的支出有所减少。筹资活动现金流出从2023年的-3560.17亿元减少到2026年的98.07亿元，显示出公司在筹资活动中的支出大幅减少。

这些数据背后反映了市场环境的变化和行业动态。随着全球经济的复苏和消费者信心的恢复，人们对娱乐和文化的需求逐渐增加，推动了电影行业的增长。同时，技术进步也为电影行业带来了新的发展机遇，如虚拟现实、增强现实等新技术的应用，使得电影体验更加丰富多样，吸引了更多的观众。此外，政策的支持也为电影行业的发展提供了良好的外部环境，如政府对文化产业的扶持政策、税收优惠等。

然而，市场竞争依然激烈，全球电影市场的竞争格局也在不断变化。随着流媒体平台的崛起，传统电影院面临着前所未有的挑战。为了应对这一挑战，万达电影加大了对数字影院的投资力度，推出了更多高质量的电影内容，并通过与各大流媒体平台的合作，拓展了线上渠道。同时，公司还加强了对海外市场的布局，通过并购等方式，扩大了在全球范围内的影响力。

总的来说，万达电影在过去几年中取得了显著的增长，这得益于市场需求的增加、技术进步以及政策支持等因素的共同作用。未来，公司将继续保持稳健的发展态势，积极应对市场环境的变化和竞争压力，为股东创造更大的价值。"			2023年至2026年期间，公司净利润在哪一年达到最大值？	2023A	2024E	2025E	2026E	D
