fintype	type	index	image	md_path	background_story	information	round	question	A	B	C	D	answer
财务指标分析	sdt	231151	data/figure/sdt/2024-06-25--中药-白云山-公司深度报告：华南医药消费龙头稳健增长，盈利能力持续优化_page15_表2大健康板块盈利预测及估值.jpg		"在2019年至2026年的这段时间里，华南医药消费龙头白云山公司经历了市场的起伏与挑战。从图表中可以看出，公司的大健康收入在2019年达到了104.79亿元，同比增长了10.45%。然而，在2020年，由于全球疫情的爆发，市场需求急剧下降，导致公司收入骤降至78.59亿元，同比下降了25.00%。尽管如此，公司在2021年迅速恢复，收入增长至108.51亿元，同比增长38.07%。这主要得益于公司在疫情期间积极调整战略，加大研发投入，推出了一系列适应市场需求的新产品。

进入2022年，随着全球经济形势的不确定性增加，市场竞争加剧，公司的收入略有下滑，降至104.73亿元，同比下降3.48%。然而，公司通过优化成本结构和提高运营效率，毛利率保持在43.52%，净利润为16.22亿元，净利率达到15.49%。这表明公司在面对市场挑战时，能够有效控制成本，保持盈利能力。

展望未来，预计2023年至2026年，公司的收入将稳步增长，分别达到111.17亿元、120.07亿元、129.67亿元和140.05亿元，年均增长率约为8.00%。这主要得益于公司在大健康领域的持续投入和技术进步，以及对市场需求的精准把握。同时，公司将继续优化成本结构，提高运营效率，确保毛利率和净利率维持在较高水平。

然而，外部环境的变化仍然可能对公司财务表现产生影响。政策变化、市场竞争加剧以及全球经济形势的不确定性都是潜在的风险因素。例如，政府对医疗行业的监管政策可能会发生变化，影响公司的业务模式和盈利模式。此外，竞争对手的技术创新和市场策略也可能对公司造成冲击。因此，公司需要密切关注市场动态，灵活调整战略，以应对这些外部风险。

总体而言，白云山公司在过去几年中展现了强大的韧性和适应能力，成功应对了市场挑战，并实现了稳健增长。未来，公司将继续加强技术创新和市场拓展，提升核心竞争力，以实现可持续发展。"			根据表格数据，2023年大健康板块的毛利率为44.41%，如果2024年的毛利率保持不变，且营业成本为66.04亿元，那么2024年的大健康收入应为多少？	120.07亿元	125.00亿元	130.00亿元	135.00亿元	A
财务指标分析	sdt	231156	data/figure/sdt/2024-06-23--银行-常熟银行-深度报告：ROE向上前景可期_page3_图3六家高ROE银行2023年ROE杜邦分解.jpg		"在2024年6月23日发布的银行行业深度报告中，常熟银行的表现尤为引人注目。报告显示，常熟银行的ROE（净资产收益率）达到了18.8%，远高于其他几家高ROE银行。这一亮眼表现的背后，是常熟银行在多个方面的出色表现。

首先，从营业收入来看，常熟银行的营业收入增长率为3.2%，略高于招商银行和宁波银行，但低于成都银行。这表明常熟银行在市场拓展方面取得了不错的成绩，但仍有提升空间。利息净收入方面，常熟银行的增长率为2.7%，同样高于招商银行和宁波银行，显示出其在贷款业务上的优势。利息收入方面，常熟银行的增长率高达4.8%，远超其他银行，这得益于其在利率管理上的精准把控。利息支出方面，常熟银行的下降幅度为2.1%，与其他银行相当，显示出其在成本控制方面的稳健。

手续费及佣金净收入方面，常熟银行的增长率为0.0%，虽然没有显著增长，但也保持了稳定。净其他非息收入方面，常熟银行的增长率为0.4%，显示出其在多元化经营方面的努力。税金及附加方面，常熟银行与大多数银行一样，保持了零增长。管理费用方面，常熟银行的下降幅度为1.2%，显示出其在内部管理上的高效。

PPOP（拨备前利润）方面，常熟银行的增长率为2.0%，显示出其在风险管理方面的稳健。减值损失方面，常熟银行的下降幅度为0.7%，显示出其在资产质量方面的良好表现。税前利润方面，常熟银行的增长率为1.3%，显示出其在盈利能力方面的提升。所得税方面，常熟银行的下降幅度为0.2%，显示出其在税务筹划方面的优势。

ROAA（资产收益率）方面，常熟银行为1.1%，略低于招商银行和宁波银行，但高于杭州银行和江苏银行。权益乘数方面，常熟银行为13，略低于招商银行和宁波银行，但高于杭州银行和江苏银行。ROAE（股东权益回报率）方面，常熟银行为13.7%，略低于招商银行和宁波银行，但高于杭州银行和江苏银行。

总体来看，常熟银行在多个方面的表现都十分出色，尤其是在利息收入、利息支出和PPOP等方面。这些优异表现的背后，是常熟银行在市场拓展、利率管理、成本控制、风险管理等方面的精准把控。未来，随着市场竞争的加剧和技术进步的推动，常熟银行有望继续保持良好的发展势头。"			根据图中数据，哪家银行的利息净收入占比最高？	成都	招商	宁波	杭州	B
财务指标分析	sdt	231179	data/figure/sdt/2024-06-13--医疗器械-麦澜德-女性康复器械领跑者，健康与美战略初现_page8_图表12主要控股参股公司.jpg		"在一个充满机遇与挑战的医疗科技市场中，南京锐诗得医疗科技有限公司、南京麦澜德医疗技术研究院有限公司、南京佳澜健康管理有限公司等企业正以其独特的业务模式和技术创新，在激烈的市场竞争中崭露头角。这些公司不仅在运动康复设备、产后康复设备、盆底超声影像设备等领域取得了显著进展，还通过不断的技术研发和市场拓展，逐步构建起一个覆盖从产品研发到销售服务的完整产业链。

然而，数据背后的故事远不止于此。以南京锐诗得医疗科技有限公司为例，尽管其主营运动康复设备的研发、生产和销售，但63%的持股比例和1,347.98万元的营业收入显示出公司在这一领域的市场份额并不算大。这可能与其产品线相对单一、市场竞争激烈有关。而南京麦澜德医疗技术研究院有限公司则专注于培训相关业务，虽然持股比例高达99%，但营业收入仅为34.65万元，净利润为0.89万元，显示出该领域竞争同样激烈，且市场需求有限。

相比之下，南京佳澜健康管理有限公司凭借100%的持股比例和5,314.55万元的营业收入，以及2,418.48万元的净利润，成为行业中的佼佼者。该公司主要经营盆底及产后康复设备的研发、生产、销售及服务，这表明随着人们对健康意识的提高，尤其是对女性健康的重视，此类设备的需求正在快速增长。同时，技术进步也为这些设备的普及提供了有力支持，使得公司能够迅速占领市场。

然而，全球经济形势的变化和政策环境的不确定性，也给这些公司带来了新的挑战。例如，全球经济放缓可能导致消费者减少非必需品的支出，从而影响康复设备的销售。此外，政府对医疗行业的监管政策也可能发生变化，进一步影响公司的运营成本和盈利能力。因此，这些公司需要密切关注宏观经济动态，及时调整战略，以应对潜在的风险。

总体来看，尽管面临诸多挑战，但通过不断创新和优化业务模式，这些医疗科技公司仍然有望在未来实现持续增长。"			如果南京麦特斯特医疗器械有限公司的营业收入增长10%，其净利润将增加多少万元？	29.02	31.92	34.58	37.58	B
财务指标分析	sdt	231188	data/figure/sdt/2024-06-11--中药-马应龙-肛肠细分行业龙头，百年品牌守正创新_page18_表4公司收入拆分及盈利预测百万元.jpg		"在2022年至2025年的这段时间里，中药行业经历了一系列显著的变化。从图表中可以看出，马应龙作为肛肠细分行业的龙头，其总收入在2022年达到了3532.38亿元，但随后在2023年下降至3136.75亿元，降幅达11.20%。这一变化背后的原因是多方面的。首先，市场需求的波动对公司的财务表现产生了直接影响。随着全球经济形势的不确定性增加，消费者对非必需品的支出变得更加谨慎，这导致了公司收入的下滑。其次，政策环境的变化也对公司产生了影响。近年来，政府加大了对中医药行业的监管力度，尤其是在药品质量和价格方面，这使得公司在生产和销售过程中面临更高的成本压力。

然而，从2024年开始，马应龙的收入开始逐步回升，预计到2025年将达到4457.53亿元，同比增长11.90%。这一增长趋势的背后，有几个关键因素起到了推动作用。首先，技术进步和创新为公司带来了新的增长点。马应龙不断加大对研发的投入，开发出更多具有竞争力的新产品，满足了市场对高质量、高性价比药品的需求。其次，公司积极拓展国际市场，通过与海外合作伙伴的合作，扩大了产品的全球市场份额。此外，随着消费者健康意识的提高，对中医药的认可度也在不断提升，这为公司创造了更多的市场机会。

在医药工业领域，马应龙的表现尤为突出。2022年，该领域的收入为2073.39亿元，但在2023年下降至1834.47亿元。不过，从2024年开始，收入预计将逐步回升，到2025年达到2712.01亿元。其中，治痔类产品和其他产品的收入增长尤为显著，分别从2022年的1488.34亿元和585.05亿元增长至2025年的1954.14亿元和757.87亿元。这表明公司在这些细分市场的竞争优势不断增强，能够更好地满足消费者的需求。

医疗服务领域也是马应龙的重要业务板块之一。尽管2022年该领域的收入仅为258.67亿元，但在2023年增长至344.76亿元，并预计在2025年达到756.32亿元。这一增长主要得益于公司对医疗服务的投资和布局，以及消费者对高质量医疗服务需求的增加。同时，医药流通领域的收入也呈现出稳步增长的趋势，从2022年的1354.03亿元增长至2025年的1199.20亿元。

总体来看，尽管面临着宏观经济环境的不确定性和市场竞争的压力，马应龙通过不断创新和拓展市场，成功实现了业绩的稳步增长。未来，随着公司继续加强技术研发和市场拓展，预计其在中药行业的领先地位将进一步巩固，为股东创造更大的价值。"			如果2025年内部抵消为220.00万元，那么2025年营业总收入的实际值是多少？	3983.59	4457.53	4237.59	4237.53	C
财务指标分析	sdt	231242	data/figure/sdt/2024-04-11--软件开发-思维列控-业绩稳步增长，有望持续受益于铁路设备更替_page1_表1公司分业务收入及毛利率预测.jpg		"在2023年，随着铁路设备更新换代的推进，LJK列控业务迎来了显著的增长。根据图表显示，LJK列控业务的收入从2023年的703.42百万元增长到2026年的1130.73百万元，增速保持在两位数以上，显示出强劲的增长势头。这背后的主要驱动因素是铁路行业的技术进步和市场需求的增加。随着高铁网络的不断扩展和完善，对高效、安全的列车控制系统的需求日益增长，为LJK列控业务提供了广阔的市场空间。

与此同时，机车安防业务也呈现出良好的增长态势。尽管2023年该业务的收入略有下降，但随后几年的增速迅速回升，预计到2026年将达到333.91百万元。这一变化反映了市场对机车安全监控系统的重视程度不断提高。随着铁路运输量的增加，确保行车安全成为重中之重，因此对机车安防系统的需求也随之增加。

高铁运维监测业务同样表现出色，收入从2023年的255.87百万元增长到2026年的404.09百万元，增速稳定在16%左右。这主要得益于高铁网络的持续扩张和对高铁运维监测系统需求的增加。随着高铁里程的不断增加，对高铁运维监测系统的要求也越来越高，从而推动了该业务的发展。

其他业务方面，虽然收入规模较小，但增速稳定，显示出公司在多元化发展方面的努力。总体来看，公司的总收入从2023年的1180.24百万元增长到2026年的1906.77百万元，增速保持在15%以上，显示出公司整体业务的良好发展态势。

然而，市场竞争和技术进步仍然是影响公司财务表现的重要外部因素。随着行业竞争的加剧和技术的不断进步，公司需要不断创新和提升产品性能，以保持竞争优势。此外，政策变化和全球经济形势也可能对公司产生影响。例如，政府对铁路行业的投资政策和全球经济的波动都可能对公司的业务发展产生重要影响。因此，公司需要密切关注市场动态和宏观经济环境，及时调整战略，以应对各种挑战。"			其他业务在2023年的收入为31.44百万元，增速为1.81%，如果2024年收入为34.58百万元，请问2024年的增速是多少？	10.00%	11.00%	12.00%	13.00%	A
财务指标分析	sdt	231272	data/figure/sdt/2024-03-11--非金属材料-中科电气-锂电负极头部企业，盈利能力持续改善_page9_图表13锂电负极市场空间测算.jpg		"在2021年至2025年的预测期内，全球锂电池市场展现出了强劲的增长势头。从图表中可以看出，全球动力电池出货量从2021年的392.0GWh增长到2025年的1454.1GWh，年均复合增长率高达76%。这一增长主要得益于电动汽车市场的爆发式增长和各国政府对新能源汽车的大力扶持政策。与此同时，储能电池市场也呈现出快速增长的趋势，从2021年的44.0GWh增长到2025年的391.3GWh，年均复合增长率高达177%。这背后的主要驱动因素是可再生能源的快速发展和储能技术的进步。

消费电池市场则相对稳定，从2021年的126.4GWh增长到2025年的155.8GWh，年均复合增长率仅为15%。这主要是由于智能手机、笔记本电脑等消费电子产品的市场需求趋于饱和，且技术创新带来的换机周期延长。总体来看，全球锂电池出货量从2021年的562.4GWh增长到2025年的2001.1GWh，年均复合增长率高达70%。

随着锂电池需求的快速增长，负极材料的需求也随之增加。平均1GWh锂电池对负极材料的需求量为1200吨，因此全球锂电池对负极材料的需求量从2021年的67.5万吨增长到2025年的240.1万吨，年均复合增长率高达70%。这表明负极材料市场将迎来巨大的发展机遇。

然而，市场竞争也在加剧。随着越来越多的企业进入锂电池和负极材料市场，行业竞争将更加激烈。同时，全球经济形势的变化也可能对市场产生影响。例如，原材料价格波动、供应链中断等问题都可能对企业的财务表现产生不利影响。此外，政策变化也是一个重要的外部因素。各国政府对新能源汽车和储能行业的支持政策可能会发生变化，从而影响市场需求。

综上所述，全球锂电池市场在未来几年内将继续保持高速增长，但同时也面临着激烈的市场竞争和外部环境的不确定性。企业需要密切关注市场动态，及时调整战略以应对各种挑战。"			2022年全球消费电池出货量相比2021年增长了多少百分比？	15%	-3%	5%	70%	A
财务指标分析	hg	231313	data/figure/hg/2023-12-01--国金证券-2024年宏观经济形势展望：江春入旧年_page7_图表12美国CMBS逾期率.jpg		"在2023年12月，国金证券发布了一份关于2024年宏观经济形势展望的报告。其中，图表12展示了美国CMBS（商业房地产抵押贷款支持证券）逾期率的变化趋势。这张图表不仅揭示了过去一年中不同行业CMBS逾期率的波动情况，还为未来的市场环境和经济趋势提供了宝贵的洞察。

从图表中可以看出，总体而言，美国CMBS逾期率在过去一年中呈现出一定的波动性。2022年10月，整体逾期率为3%，而到了2023年10月，这一数字上升至4.8%。这种变化背后的原因是多方面的。首先，全球经济形势的不确定性导致市场需求波动，进而影响了商业地产的租金收入。其次，技术进步和远程工作的普及改变了办公空间的需求模式，使得办公楼市场的表现尤为突出。数据显示，办公楼的CMBS逾期率从2022年10月的1.8%上升至2023年10月的4.8%，这反映了该行业面临的挑战。

与此同时，零售业的CMBS逾期率也出现了显著增长，从2022年10月的2.6%上升至2023年10月的6.7%。这主要是由于消费者行为的变化和电子商务的崛起，传统零售业面临着前所未有的压力。相比之下，工业和酒店业的CMBS逾期率相对较低，分别为2.6%和4.9%，显示出这些行业在当前市场环境下的相对稳定性。

值得注意的是，政策变化和市场竞争也是影响公司财务表现的重要外部因素。例如，政府对商业地产的税收政策调整可能会直接影响投资者的回报预期，从而影响CMBS市场的表现。此外，随着全球供应链的重组和地缘政治风险的增加，跨国公司的运营成本也在上升，这将进一步加剧市场竞争。

综上所述，通过对美国CMBS逾期率的分析，我们可以看到不同行业在当前市场环境下面临的挑战和机遇。未来，随着全球经济形势的演变和技术进步的推动，商业地产市场将继续经历深刻的变革。对于投资者和企业来说，密切关注这些趋势并采取相应的策略将是至关重要的。"			从图表中可以看出，2023年10月哪个类别的CMBS逾期率最低？	总体	工业	公寓	酒店	B
财务指标分析	fs	210216	data/figure/fs/2024-09-21--中药-莱茵生物-24前三季度归母净利润预计延续高增长，看好产能释放提升盈利能力_page1_财务预测摘要.jpg				1.0	根据资产负债表，2023年的流动资产合计是多少？	1180.54	1,819.80	2,566.17		A
财务指标分析	fs	210216	data/figure/fs/2024-09-21--中药-莱茵生物-24前三季度归母净利润预计延续高增长，看好产能释放提升盈利能力_page1_财务预测摘要.jpg				2.0	根据利润表，2023年的营业利润是多少？	253.69	118.32	248.44		B
财务指标分析	fs	210216	data/figure/fs/2024-09-21--中药-莱茵生物-24前三季度归母净利润预计延续高增长，看好产能释放提升盈利能力_page1_财务预测摘要.jpg				3.0	根据主要财务比率，2023年的毛利率是多少？	24.41%	28.98%	28.97%		A
财务指标分析	fs	210278	data/figure/fs/2024-09-02--化学制药-仙琚制药-利润环比加速增长，经营趋势不断向好_page7_图表13仙琚制药财务报表预测.jpg				4.0	根据主要财务比率，2023年的ROE是多少？	9.7%	14.1%	18.0%		A
财务指标分析	fs	220020	data/figure/fs/互联网服务-天阳科技-中标多个千万项目，发布天策多模态大模型_page1_盈利预测表.jpg,data/figure/fs/互联网服务-博彦科技-营收稳健增长，加速新兴业务领域布局_page2_财务报表和主要财务比率.jpg,data/figure/fs/互联网服务-中科星图-公司信息更新报告：收入持续高增，向商业航天全产业链战略跃迁_page1_附财务预测摘要.jpg				1.0	根据资产负债表和利润表，2023年天阳科技的净利润是多少？	114	140	171	213	A
财务指标分析	fs	220020	data/figure/fs/互联网服务-天阳科技-中标多个千万项目，发布天策多模态大模型_page1_盈利预测表.jpg,data/figure/fs/互联网服务-博彦科技-营收稳健增长，加速新兴业务领域布局_page2_财务报表和主要财务比率.jpg,data/figure/fs/互联网服务-中科星图-公司信息更新报告：收入持续高增，向商业航天全产业链战略跃迁_page1_附财务预测摘要.jpg				2.0	根据资产负债表和利润表，2023年博彦科技的净利润是多少？	214	228	378	483	A
财务指标分析	fs	220020	data/figure/fs/互联网服务-天阳科技-中标多个千万项目，发布天策多模态大模型_page1_盈利预测表.jpg,data/figure/fs/互联网服务-博彦科技-营收稳健增长，加速新兴业务领域布局_page2_财务报表和主要财务比率.jpg,data/figure/fs/互联网服务-中科星图-公司信息更新报告：收入持续高增，向商业航天全产业链战略跃迁_page1_附财务预测摘要.jpg				3.0	根据资产负债表和利润表，2023年中科星图的净利润是多少？	243	482	478	663	B
财务指标分析	fs	220020	data/figure/fs/互联网服务-天阳科技-中标多个千万项目，发布天策多模态大模型_page1_盈利预测表.jpg,data/figure/fs/互联网服务-博彦科技-营收稳健增长，加速新兴业务领域布局_page2_财务报表和主要财务比率.jpg,data/figure/fs/互联网服务-中科星图-公司信息更新报告：收入持续高增，向商业航天全产业链战略跃迁_page1_附财务预测摘要.jpg				4.0	比较三家公司2023年的净利润，哪一家公司的净利润最高？	天阳科技	博彦科技	中科星图	无法确定	C
财务指标分析	fs	220020	data/figure/fs/互联网服务-天阳科技-中标多个千万项目，发布天策多模态大模型_page1_盈利预测表.jpg,data/figure/fs/互联网服务-博彦科技-营收稳健增长，加速新兴业务领域布局_page2_财务报表和主要财务比率.jpg,data/figure/fs/互联网服务-中科星图-公司信息更新报告：收入持续高增，向商业航天全产业链战略跃迁_page1_附财务预测摘要.jpg				5.0	根据现金流量表，2023年天阳科技的经营活动现金流为多少？	406	112	100	117	A
财务指标分析	fs	220020	data/figure/fs/互联网服务-天阳科技-中标多个千万项目，发布天策多模态大模型_page1_盈利预测表.jpg,data/figure/fs/互联网服务-博彦科技-营收稳健增长，加速新兴业务领域布局_page2_财务报表和主要财务比率.jpg,data/figure/fs/互联网服务-中科星图-公司信息更新报告：收入持续高增，向商业航天全产业链战略跃迁_page1_附财务预测摘要.jpg				6.0	根据现金流量表，2023年博彦科技的经营活动现金流为多少？	296	330	315	392	A
财务指标分析	lc	220464	data/figure/lc/2024-02-04--华金证券-华金宏观·双循环周报（第43期）：松地产再度加码，强非农推迟降息_page10_图19美联储本周资产规模继续缩小USDbn.jpg,data/figure/lc/2024-02-04--华金证券-华金宏观·双循环周报（第43期）：松地产再度加码，强非农推迟降息_page10_图181Y3Y信用基本利差持平BP.jpg				1.0	根据图1和图2，实体经济增长贷款在2021年至2024年的变化趋势是？	持续增长。	持续下降。	先增后减。	先减后增。	C
财务指标分析	frg	220931	data/figure/frg/2024-03-01--汽车零部件-星宇股份-自主车灯龙头的复盘与展望_page32_图27车灯是车型换代升级的必改项.jpg,data/figure/frg/2024-07-26--汽车零部件-继峰股份-首次覆盖深度报告：多元业态协同发展，内饰专家开启全球新征程_page4_图2股权结构.jpg,data/figure/frg/2024-07-18--光伏设备-禾迈股份-微逆踏浪高歌进，储能风起正当时_page4_图1公司深耕微逆前瞻布局储能.jpg				1.0	根据图片内容，以下哪个选项正确描述了所有公司的发展历程和股权结构？	特斯拉Model 3在2022款全系标配矩阵式LED前大灯，而继峰股份由WING SING INTERNATIONAL CO., LTD持有11.60%的股份。	禾迈股份在2023年成立了美国、欧洲子公司，而继峰股份由宁波继弘持有21.27%的股份。	一汽大众探歌在2023款低配标配LED前大灯，而继峰股份由王继民持有9.39%的股份。	吉利领克03在2023款高配标配矩阵式LED前大灯，而继峰股份由余万立持有6.82%的股份。	B
