fintype	type	index	image	md_path	background_story	information	round	question	A	B	C	D	answer
财务指标分析	fs	210236	data/figure/fs/2024-09-16--文化传媒-城市传媒-城市传媒：经营端稳健，教育新业态亮点频现_page2_盈利预测表百万元.jpg				1.0	根据利润表，2023年的营业利润是多少？	349百万元	433百万元	501百万元		A
财务指标分析	fs	210236	data/figure/fs/2024-09-16--文化传媒-城市传媒-城市传媒：经营端稳健，教育新业态亮点频现_page2_盈利预测表百万元.jpg				2.0	根据主要财务比率表，2023年的毛利率是多少？	30.52%	30.69%	32.74%		A
财务指标分析	fs	210236	data/figure/fs/2024-09-16--文化传媒-城市传媒-城市传媒：经营端稳健，教育新业态亮点频现_page2_盈利预测表百万元.jpg				3.0	根据主要财务比率表，2023年的净利润率是多少？	15.15%	10.98%	11.46%		A
财务指标分析	fs	210236	data/figure/fs/2024-09-16--文化传媒-城市传媒-城市传媒：经营端稳健，教育新业态亮点频现_page2_盈利预测表百万元.jpg				4.0	根据主要财务比率表，2023年的ROE是多少？	12.41%	9.37%	10.11%		A
财务指标分析	fs	210236	data/figure/fs/2024-09-16--文化传媒-城市传媒-城市传媒：经营端稳健，教育新业态亮点频现_page2_盈利预测表百万元.jpg				5.0	根据主要财务比率表，2023年的R0IC是多少？	15.88%	18.15%	19.18%		A
财务指标分析	fs	210249	data/figure/fs/2024-09-10--航天航空-中航机载-机载龙头聚焦主业，提质增效良性发展_page1_财务预测摘要.jpg				1.0	根据资产负债表，2023年的流动资产总额是多少？	55,470.08	64,429.66	73,523.42		A
财务指标分析	fs	210249	data/figure/fs/2024-09-10--航天航空-中航机载-机载龙头聚焦主业，提质增效良性发展_page1_财务预测摘要.jpg				2.0	根据利润表，2023年的营业利润是多少？	2,229.68	2,149.09	2,083.78		A
财务指标分析	fs	210249	data/figure/fs/2024-09-10--航天航空-中航机载-机载龙头聚焦主业，提质增效良性发展_page1_财务预测摘要.jpg				3.0	根据主要财务比率，2023年的毛利率是多少？	29.73%	29.32%	29.20%		A
财务指标分析	fs	210278	data/figure/fs/2024-09-02--化学制药-仙琚制药-利润环比加速增长，经营趋势不断向好_page7_图表13仙琚制药财务报表预测.jpg				1.0	根据资产负债表，2023年现金为多少？	1,660.04	3,999.87	5,430.05		A
财务指标分析	fs	210278	data/figure/fs/2024-09-02--化学制药-仙琚制药-利润环比加速增长，经营趋势不断向好_page7_图表13仙琚制药财务报表预测.jpg				2.0	根据利润表，2023年的营业成本是多少？	11,943.12	1,943.12	1,493.11		B
财务指标分析	fs	210278	data/figure/fs/2024-09-02--化学制药-仙琚制药-利润环比加速增长，经营趋势不断向好_page7_图表13仙琚制药财务报表预测.jpg				3.0	根据主要财务比率，2023年的毛利率是多少？	52.9%	55.1%	56.5%		A
财务指标分析	sdt	210328	data/figure/sdt/2022-12-21--半导体-杰华特-杰华特深度报告：大陆稀缺虚拟IDM玩家，率先布局服务器DCDC_page30_图表68TIDrMOS梳理.jpg				1.0	在表格中，哪种产品的持续输出电流为20A？	CSD95492QVM	CSD97394Q4M	CSD95379Q3M		A
财务指标分析	sdt	210328	data/figure/sdt/2022-12-21--半导体-杰华特-杰华特深度报告：大陆稀缺虚拟IDM玩家，率先布局服务器DCDC_page30_图表68TIDrMOS梳理.jpg				2.0	如果需要订购数量最多的两种产品，它们的持续输出电流分别是多少？	20A, 25A	25A, 30A	30A, 40A		C
财务指标分析	sdt	210328	data/figure/sdt/2022-12-21--半导体-杰华特-杰华特深度报告：大陆稀缺虚拟IDM玩家，率先布局服务器DCDC_page30_图表68TIDrMOS梳理.jpg				3.0	哪种产品的每10A价格最高？	CSD95496QVM	CSD97396Q4M	CSD95377Q4M		A
财务指标分析	sdt	210328	data/figure/sdt/2022-12-21--半导体-杰华特-杰华特深度报告：大陆稀缺虚拟IDM玩家，率先布局服务器DCDC_page30_图表68TIDrMOS梳理.jpg				4.0	哪种产品的持续输出电流为30A且订购数量为2500个？	CSD97396Q4M	CSD95377Q4M	CSD97396Q4M		A
财务指标分析	sdt	210328	data/figure/sdt/2022-12-21--半导体-杰华特-杰华特深度报告：大陆稀缺虚拟IDM玩家，率先布局服务器DCDC_page30_图表68TIDrMOS梳理.jpg				5.0	哪种产品的持续输出电流为40A且订购数量为1000个？	CSD95482RWJ	CSD95496QVM	CSD97370AQ5M		B
财务指标分析	sdt	210379	data/figure/sdt/2022-11-22--有色金属-金田股份-铜加工与稀土永磁双轮驱动业绩增长，产品迈向高端化_page21_表11部分磁材企业产量及扩产计划吨.jpg				1.0	根据表格数据，中科三环2021年产量为多少？	8702	17000	20000		A
财务指标分析	sdt	210379	data/figure/sdt/2022-11-22--有色金属-金田股份-铜加工与稀土永磁双轮驱动业绩增长，产品迈向高端化_page21_表11部分磁材企业产量及扩产计划吨.jpg				2.0	假设正海磁材计划到2026年前达到3.6万吨的生产能力，那么其2021年的产能与2022年的产能规划相比，哪个更高？	2021年产能	2022年产能规划	无法确定		B
财务指标分析	sdt	210379	data/figure/sdt/2022-11-22--有色金属-金田股份-铜加工与稀土永磁双轮驱动业绩增长，产品迈向高端化_page21_表11部分磁材企业产量及扩产计划吨.jpg				3.0	宁波韵升在包头建设15000吨产能后，其产能将提升至多少万吨？	3.6	3.5	3.7		A
财务指标分析	sdt	210379	data/figure/sdt/2022-11-22--有色金属-金田股份-铜加工与稀土永磁双轮驱动业绩增长，产品迈向高端化_page21_表11部分磁材企业产量及扩产计划吨.jpg				4.0	英洛华在扩产2000吨新产线建设中，其产能将提升至多少万吨？	1.2	1.1	1.3		A
财务指标分析	sdt	210379	data/figure/sdt/2022-11-22--有色金属-金田股份-铜加工与稀土永磁双轮驱动业绩增长，产品迈向高端化_page21_表11部分磁材企业产量及扩产计划吨.jpg				5.0	大地熊2025年的规划产能是多少？	2.1	2.2	2.0		A
财务指标分析	sdt	210403	data/figure/sdt/2022-11-11--纺织服装-华利集团-高效率+重研发+强运营构筑深厚壁垒，携手优质客户共同成长_page40_表15公司营业收入预测.jpg				3.0	2018年Yoy增长率是多少？	-1.0%	2.7%	4.3%		B
财务指标分析	sdt	210403	data/figure/sdt/2022-11-11--纺织服装-华利集团-高效率+重研发+强运营构筑深厚壁垒，携手优质客户共同成长_page40_表15公司营业收入预测.jpg				4.0	2019年产能利用率与2018年相比有何变化？	提高	降低	不变		A
财务指标分析	sdt	210403	data/figure/sdt/2022-11-11--纺织服装-华利集团-高效率+重研发+强运营构筑深厚壁垒，携手优质客户共同成长_page40_表15公司营业收入预测.jpg				5.0	2019年Yoy增长率与2018年相比有何变化？	提高	降低	不变		B
财务指标分析	lc	210429	data/figure/lc/2024-10-09--中信建投期货-中东地缘局势骤然升级，叠加降温过程推涨TTF_page17_美国居民商业需求Bcf预估.jpg				5.0	结合以上信息，你认为未来几年期货价格的走势会如何变化？以下为选项	期货价格将持续上涨	期货价格将持续下跌	期货价格将先跌后涨		C
财务指标分析	lc	210429	data/figure/lc/2024-10-09--中信建投期货-中东地缘局势骤然升级，叠加降温过程推涨TTF_page17_美国居民商业需求Bcf预估.jpg				6.0	如果你是投资者，你会如何根据这张图表进行投资决策？以下为选项	立即买入期货合约	等待价格稳定后再考虑买入	避免投资期货市场		B
财务指标分析	lc	210590	data/figure/lc/2024-07-26--中国银河-美国二季度GDP数据：经济韧性支持“软着陆”，首次降息仍是“预防性”_page4_图10新房库存升至9个月以上压制住宅投资.jpg				1.0	请你描述一下这个图片，以下为选项	该图表显示了新房库存比、成屋库存比和新屋成屋销售加权库存比的变化趋势。	该图表显示了美国GDP的增长情况。	该图表显示了中国银河的股价走势。		A
财务指标分析	lc	210590	data/figure/lc/2024-07-26--中国银河-美国二季度GDP数据：经济韧性支持“软着陆”，首次降息仍是“预防性”_page4_图10新房库存升至9个月以上压制住宅投资.jpg				2.0	根据图表，哪一年新房库存比达到了最高点？	2008年	2010年	2012年		A
财务指标分析	lc	210590	data/figure/lc/2024-07-26--中国银河-美国二季度GDP数据：经济韧性支持“软着陆”，首次降息仍是“预防性”_page4_图10新房库存升至9个月以上压制住宅投资.jpg				3.0	新房库存比在2008年达到最高点后，接下来几年的趋势如何？	持续下降	波动上升	保持稳定		A
财务指标分析	lc	210590	data/figure/lc/2024-07-26--中国银河-美国二季度GDP数据：经济韧性支持“软着陆”，首次降息仍是“预防性”_page4_图10新房库存升至9个月以上压制住宅投资.jpg				4.0	根据图表，新屋成屋销售加权库存比在2008年后的变化趋势与新房库存比有何不同？	新屋成屋销售加权库存比在2008年后持续下降，而新房库存比波动上升。	新屋成屋销售加权库存比在2008年后波动上升，而新房库存比持续下降。	新屋成屋销售加权库存比在2008年后保持稳定，而新房库存比波动上升。		B
财务指标分析	lc	210590	data/figure/lc/2024-07-26--中国银河-美国二季度GDP数据：经济韧性支持“软着陆”，首次降息仍是“预防性”_page4_图10新房库存升至9个月以上压制住宅投资.jpg				5.0	结合图表信息，你认为2008年新房库存比达到最高点的原因可能是什么？	经济衰退导致需求减少，库存增加。	房地产市场过热，供应过剩。	政府政策调整，限制购房。		A
财务指标分析	lc	210590	data/figure/lc/2024-07-26--中国银河-美国二季度GDP数据：经济韧性支持“软着陆”，首次降息仍是“预防性”_page4_图10新房库存升至9个月以上压制住宅投资.jpg				6.0	根据图表，2019-2021年间新房库存比和新屋成屋销售加权库存比的变化趋势有何特点？	两者都呈上升趋势，但新房库存比上升更快。	两者都呈下降趋势，但新房库存比下降更快。	新房库存比呈上升趋势，新屋成屋销售加权库存比呈下降趋势。		A
财务指标分析	lc	210593	data/figure/lc/2024-07-22--西南证券-宏观周报：货币政策保持稳健，“特朗普交易”加速_page9_图9农产品价格指数上升更新至2024年7月18日.jpg				1.0	请你描述一下这个图片，以下为选项	显示了2019年至2024年农产品批发价格指数的变化趋势	显示了2019年至2024年股票市场的波动情况	显示了2019年至2024年外汇汇率的变动		A
财务指标分析	lc	210593	data/figure/lc/2024-07-22--西南证券-宏观周报：货币政策保持稳健，“特朗普交易”加速_page9_图9农产品价格指数上升更新至2024年7月18日.jpg				2.0	根据第一轮的回答，这张图表显示的是哪一年农产品批发价格指数达到最高点？	2020-07-18	2021-01-18	2023-07-18		B
财务指标分析	lc	210593	data/figure/lc/2024-07-22--西南证券-宏观周报：货币政策保持稳健，“特朗普交易”加速_page9_图9农产品价格指数上升更新至2024年7月18日.jpg				3.0	结合第二轮的答案，你认为导致2021年初农产品批发价格指数达到最高点的原因可能是什么？	货币政策收紧	自然灾害影响	市场需求增加		B
财务指标分析	lc	210593	data/figure/lc/2024-07-22--西南证券-宏观周报：货币政策保持稳健，“特朗普交易”加速_page9_图9农产品价格指数上升更新至2024年7月18日.jpg				4.0	根据第三轮的回答，如果自然灾害是导致农产品价格上涨的主要原因，那么这种价格上涨对消费者有什么影响？	消费者购买力下降	消费者需求减少	消费者转向其他替代品		A
财务指标分析	lc	210593	data/figure/lc/2024-07-22--西南证券-宏观周报：货币政策保持稳健，“特朗普交易”加速_page9_图9农产品价格指数上升更新至2024年7月18日.jpg				5.0	结合第四轮的回答，如果消费者购买力下降，会对宏观经济产生什么影响？	通货膨胀加剧	经济增长放缓	失业率降低		B
财务指标分析	lc	210593	data/figure/lc/2024-07-22--西南证券-宏观周报：货币政策保持稳健，“特朗普交易”加速_page9_图9农产品价格指数上升更新至2024年7月18日.jpg				6.0	根据第五轮的回答，如果经济增长放缓，政府可能会采取什么措施来刺激经济？	提高利率	减税降费	增加出口关税		B
财务指标分析	frg	210836	data/figure/frg/2024-06-14--消费电子-安克创新-跨境电商龙头企业，成长动能充沛_page4_图2安克创新股份股权结构截至公司2024年一季报.jpg				1.0	请你描述一下这个图片，以下为选项	这是一张股权结构图，显示了安克创新科技股份有限公司的股东及其持股比例。	这是一张财务报表，显示了公司的收入和支出情况。	这是一张组织结构图，显示了公司的部门设置。		A
财务指标分析	frg	210836	data/figure/frg/2024-06-14--消费电子-安克创新-跨境电商龙头企业，成长动能充沛_page4_图2安克创新股份股权结构截至公司2024年一季报.jpg				2.0	根据第一轮的回答，这张股权结构图中最大的股东是谁？以下为选项	阳萌	赵东平	香港中央结算有限公司		A
财务指标分析	frg	210836	data/figure/frg/2024-06-14--消费电子-安克创新-跨境电商龙头企业，成长动能充沛_page4_图2安克创新股份股权结构截至公司2024年一季报.jpg				3.0	根据第二轮的回答，阳萌持有安克创新科技股份有限公司多少股份？以下为选项	44.04%	11.98%	8.76%		A
财务指标分析	frg	210836	data/figure/frg/2024-06-14--消费电子-安克创新-跨境电商龙头企业，成长动能充沛_page4_图2安克创新股份股权结构截至公司2024年一季报.jpg				4.0	根据第三轮的回答，除了阳萌之外，第二大个人股东是谁？以下为选项	赵东平	吴文龙	贺丽		A
财务指标分析	frg	210836	data/figure/frg/2024-06-14--消费电子-安克创新-跨境电商龙头企业，成长动能充沛_page4_图2安克创新股份股权结构截至公司2024年一季报.jpg				5.0	根据第四轮的回答，赵东平持有安克创新科技股份有限公司多少股份？以下为选项	11.98%	8.76%	4.25%		A
财务指标分析	frg	210836	data/figure/frg/2024-06-14--消费电子-安克创新-跨境电商龙头企业，成长动能充沛_page4_图2安克创新股份股权结构截至公司2024年一季报.jpg				6.0	根据第五轮的回答，如果阳萌和赵东平决定联合行动，他们总共持有安克创新科技股份有限公司多少股份？以下为选项	56.02%	55.82%	52.8%		A
财务指标分析	frg	210871	data/figure/frg/2024-01-19--美容护理-丸美股份-首次覆盖报告：主品牌蓄力调整可期，恋火打开彩妆第二增长曲线_page22_图32丸美明星代言梳理.jpg				2.0	从2007年到2023年，丸美股份的代言人策略发生了什么变化？以下为选项	代言人越来越年轻化	代言人越来越多样化	代言人越来越国际化		A
财务指标分析	frg	210871	data/figure/frg/2024-01-19--美容护理-丸美股份-首次覆盖报告：主品牌蓄力调整可期，恋火打开彩妆第二增长曲线_page22_图32丸美明星代言梳理.jpg				3.0	为什么丸美股份会选择年轻化的代言人策略？以下为选项	吸引年轻消费者，扩大市场份额	提高品牌知名度，增加销售额	降低代言成本，提高利润率		A
财务指标分析	frg	210871	data/figure/frg/2024-01-19--美容护理-丸美股份-首次覆盖报告：主品牌蓄力调整可期，恋火打开彩妆第二增长曲线_page22_图32丸美明星代言梳理.jpg				4.0	结合金融理论，丸美股份的代言人策略对其股价有何影响？以下为选项	积极影响，因为代言人策略能够提升品牌价值和市场竞争力	消极影响，因为代言人策略会增加运营成本，影响利润	没有影响，因为代言人策略与股价无关		A
财务指标分析	hg	210981	data/figure/hg/2024-07-26--汽车零部件-继峰股份-首次覆盖深度报告：多元业态协同发展，内饰专家开启全球新征程_page17_图36平均产品单价元套.jpg				5.0	假设公司每年销售1000套乘用车座椅总成，每套利润率为20%，那么每年的利润是多少？以下为选项	1600000元	1760000元	1920000元	B	
财务指标分析	hg	211025	data/figure/hg/2024-07-18--光伏设备-禾迈股份-微逆踏浪高歌进，储能风起正当时_page18_图36Enphase禾迈昱能销售商分布对比家.jpg				1.0	请你描述一下这个图片，以下为选项	该图表显示了Enphase、禾迈和显能三家公司在不同地区的销售商分布对比	该图表显示了Enphase、禾迈和显能在欧洲的销售数据	该图表显示了Enphase、禾迈和显能在北美的销售数据	A	
财务指标分析	hg	211025	data/figure/hg/2024-07-18--光伏设备-禾迈股份-微逆踏浪高歌进，储能风起正当时_page18_图36Enphase禾迈昱能销售商分布对比家.jpg				2.0	根据图表，哪一家公司在欧洲的销售商数量最多？	Enphase	禾迈	显能	A	
财务指标分析	hg	211025	data/figure/hg/2024-07-18--光伏设备-禾迈股份-微逆踏浪高歌进，储能风起正当时_page18_图36Enphase禾迈昱能销售商分布对比家.jpg				3.0	在拉美地区，哪家公司的销售商数量最少？	Enphase	禾迈	显能	B	
财务指标分析	hg	211031	data/figure/hg/2024-07-15--电力行业-中闽能源-优质新能源运营商，海上风电发展空间较大_page21_图322022年福建省制造业能耗居前的细分行业万吨标准煤.jpg				1.0	请你描述一下这个图片，以下为选项	2022年福建省制造业能耗居前的细分行业万吨标准煤消耗量	2022年福建省制造业各行业的利润情况	2022年福建省制造业各行业的产值分布	A	
财务指标分析	hg	211031	data/figure/hg/2024-07-15--电力行业-中闽能源-优质新能源运营商，海上风电发展空间较大_page21_图322022年福建省制造业能耗居前的细分行业万吨标准煤.jpg				2.0	根据图片，哪个行业是能耗最高的？	化学原料和化学制品制造业	黑色金属冶炼和压延加工业	石油加工、炼焦和核燃料加工业	C	
财务指标分析	hg	211031	data/figure/hg/2024-07-15--电力行业-中闽能源-优质新能源运营商，海上风电发展空间较大_page21_图322022年福建省制造业能耗居前的细分行业万吨标准煤.jpg				3.0	如果要减少福建省制造业的能耗，应该优先考虑哪些行业？	橡胶和塑料制品业	非金属矿物制品业	石油加工、炼焦和核燃料加工业	C	
财务指标分析	hg	211075	data/figure/hg/2024-06-30--文化传媒-万达电影-深度报告：重整旗鼓，三大战略蓄势待发_page36_图表短期借款长期借款亿元.jpg				3.0	为什么2020年的短期借款为0？,以下为选项	公司可能在2020年偿还了所有短期借款。	公司可能在2020年没有新的短期借款需求。	数据记录错误。	A	
财务指标分析	hg	211075	data/figure/hg/2024-06-30--文化传媒-万达电影-深度报告：重整旗鼓，三大战略蓄势待发_page36_图表短期借款长期借款亿元.jpg				4.0	根据图表，2021年的短期借款和长期借款分别是多少？,以下为选项	31.1亿和21.6亿	21.6亿和31.1亿	21.6亿和0.0亿	A	
财务指标分析	hg	211075	data/figure/hg/2024-06-30--文化传媒-万达电影-深度报告：重整旗鼓，三大战略蓄势待发_page36_图表短期借款长期借款亿元.jpg				5.0	从2015年到2024年第一季度，长期借款的变化趋势是怎样的？,以下为选项	总体呈下降趋势	总体呈上升趋势	先上升后下降	A	
财务指标分析	hg	211075	data/figure/hg/2024-06-30--文化传媒-万达电影-深度报告：重整旗鼓，三大战略蓄势待发_page36_图表短期借款长期借款亿元.jpg				6.0	结合图表数据，你认为万达电影在2022年采取了什么财务策略？,以下为选项	增加了短期借款以应对短期资金需求。	减少了长期借款以降低财务风险。	保持短期借款不变，增加长期借款。	B	
财务指标分析	sdt	220050	data/figure/sdt/2022-11-23--电池-鹏辉能源-公司首次覆盖报告：户储电池全球前二，大储电池放量在即_page22_表17公司营收拆分与盈利预测.jpg,data/figure/sdt/2022-11-23--电池-鹏辉能源-公司首次覆盖报告：户储电池全球前二，大储电池放量在即_page16_表12预计2025年全球表后储能市场规模超100GWh.jpg,data/figure/sdt/2022-11-23--电池-鹏辉能源-公司首次覆盖报告：户储电池全球前二，大储电池放量在即_page15_表1110kW光伏系统配储的IRR为186.jpg				1.0	根据上一轮问题的答案，储能电池在2023年的毛利率预测是多少？	19.2%	18.6%	18.0%	16.7%	A
财务指标分析	sdt	220050	data/figure/sdt/2022-11-23--电池-鹏辉能源-公司首次覆盖报告：户储电池全球前二，大储电池放量在即_page22_表17公司营收拆分与盈利预测.jpg,data/figure/sdt/2022-11-23--电池-鹏辉能源-公司首次覆盖报告：户储电池全球前二，大储电池放量在即_page16_表12预计2025年全球表后储能市场规模超100GWh.jpg,data/figure/sdt/2022-11-23--电池-鹏辉能源-公司首次覆盖报告：户储电池全球前二，大储电池放量在即_page15_表1110kW光伏系统配储的IRR为186.jpg				2.0	根据上一轮问题的答案，储能电池在2023年的营业成本预测是多少？	108.71亿元	168.33亿元	133.60亿元	50.06亿元	A
财务指标分析	sdt	220050	data/figure/sdt/2022-11-23--电池-鹏辉能源-公司首次覆盖报告：户储电池全球前二，大储电池放量在即_page22_表17公司营收拆分与盈利预测.jpg,data/figure/sdt/2022-11-23--电池-鹏辉能源-公司首次覆盖报告：户储电池全球前二，大储电池放量在即_page16_表12预计2025年全球表后储能市场规模超100GWh.jpg,data/figure/sdt/2022-11-23--电池-鹏辉能源-公司首次覆盖报告：户储电池全球前二，大储电池放量在即_page15_表1110kW光伏系统配储的IRR为186.jpg				3.0	根据上一轮问题的答案，储能电池在2023年的营业收入预测是多少？	17.42亿元	50.06亿元	133.60亿元	205.40亿元	C
财务指标分析	sdt	220050	data/figure/sdt/2022-11-23--电池-鹏辉能源-公司首次覆盖报告：户储电池全球前二，大储电池放量在即_page22_表17公司营收拆分与盈利预测.jpg,data/figure/sdt/2022-11-23--电池-鹏辉能源-公司首次覆盖报告：户储电池全球前二，大储电池放量在即_page16_表12预计2025年全球表后储能市场规模超100GWh.jpg,data/figure/sdt/2022-11-23--电池-鹏辉能源-公司首次覆盖报告：户储电池全球前二，大储电池放量在即_page15_表1110kW光伏系统配储的IRR为186.jpg				4.0	根据上一轮问题的答案，动力电池在2023年的毛利预测是多少？	2.22亿元	3.18亿元	3.53亿元	25.20亿元	B
财务指标分析	sdt	220050	data/figure/sdt/2022-11-23--电池-鹏辉能源-公司首次覆盖报告：户储电池全球前二，大储电池放量在即_page22_表17公司营收拆分与盈利预测.jpg,data/figure/sdt/2022-11-23--电池-鹏辉能源-公司首次覆盖报告：户储电池全球前二，大储电池放量在即_page16_表12预计2025年全球表后储能市场规模超100GWh.jpg,data/figure/sdt/2022-11-23--电池-鹏辉能源-公司首次覆盖报告：户储电池全球前二，大储电池放量在即_page15_表1110kW光伏系统配储的IRR为186.jpg				5.0	根据上一轮问题的答案，动力电池在2023年的毛利率预测是多少？	43%	14.0%	14.0%	11.0%	A
财务指标分析	sdt	220059	data/figure/sdt/2022-11-11--生物制品-毕得医药-公司首次覆盖报告：聚焦新药研发前端，服务全球客户_page18_表9与可比公司相比估值具有性价比.jpg,data/figure/sdt/2022-11-11--生物制品-毕得医药-公司首次覆盖报告：聚焦新药研发前端，服务全球客户_page15_表7对头部客户的依赖度逐渐降低.jpg				1.0	根据表格1.png，以下为问题。2022年药石科技的收盘价是多少？	89.75	164.10	300725.SZ	300725.SZ	A
财务指标分析	sdt	220059	data/figure/sdt/2022-11-11--生物制品-毕得医药-公司首次覆盖报告：聚焦新药研发前端，服务全球客户_page18_表9与可比公司相比估值具有性价比.jpg,data/figure/sdt/2022-11-11--生物制品-毕得医药-公司首次覆盖报告：聚焦新药研发前端，服务全球客户_page15_表7对头部客户的依赖度逐渐降低.jpg				2.0	根据表格1.png和表格2.png，以下为问题。2021年药明康德在第二大客户中的占比是多少？	9.08%	6.69%	3.39%	3.16%	A
