fintype	type	index	image	md_path	background_story	information	round	question	A	B	C	D	answer
财务指标分析	fs	230890	data/figure/fs/2024-04-22--美容护理-百亚股份-2024年一季报点评：电商+外围渠道增长亮眼，成长动能充足_page1_附表财务预测与估值.jpg		"在2023年，百亚股份的财务表现呈现出强劲的增长势头。根据图表显示，公司的营业收入从2023年的2144.15亿元增长到2026年的4073.63亿元，复合年增长率达到了惊人的20%以上。这一显著的增长主要得益于公司在电商和外围渠道的积极布局。随着消费者购物习惯的转变，越来越多的人选择在线购买商品，这为百亚股份提供了巨大的市场机会。公司通过与各大电商平台的合作，成功地将产品推向了更广泛的消费群体，从而推动了销售收入的快速增长。

与此同时，百亚股份在成本控制方面也取得了显著成效。尽管营业成本和销售费用有所增加，但其增速远低于营业收入的增长速度。这表明公司在提高运营效率和优化供应链管理方面取得了显著进展。此外，公司的毛利率从2023年的50.32%提升至2026年的53.23%，显示出公司在市场竞争中的强大议价能力和品牌影响力。

然而，值得注意的是，尽管百亚股份在收入和利润方面表现出色，但其经营活动现金流净额却出现了波动。2023年和2024年，经营活动现金流净额分别为331.39亿元和291.16亿元，但在2025年和2026年分别下降至457.52亿元和546.62亿元。这可能与公司加大投资力度、扩大生产规模有关。虽然短期内对现金流造成了一定压力，但从长期来看，这些投资有望进一步巩固公司的市场地位并提升盈利能力。

在全球经济形势复杂多变的背景下，政策变化和技术进步成为影响企业财务表现的重要外部因素。例如，近年来政府出台了一系列支持电子商务发展的政策措施，为百亚股份等企业创造了良好的发展环境。同时，随着人工智能、大数据等新技术的应用日益广泛，零售行业正经历着深刻的变革。百亚股份积极拥抱新技术，通过数据分析来精准把握市场需求，从而实现更加精细化的运营管理和客户体验提升。

综上所述，百亚股份凭借其强大的品牌优势、高效的运营模式以及对新技术的敏锐洞察，在激烈的市场竞争中脱颖而出。未来几年内，预计该公司将继续保持稳健的增长态势，并有望成为引领中国零售业创新发展的领军企业之一。"			2024E 年的营业利润比 2023A 年增加了多少？	57.15 百万元	69.72 百万元	80.33 百万元	92.94 百万元	B
财务指标分析	fs	230894	data/figure/fs/2024-04-20--电子元件-陕西华达-设备商连接器合格供方，商业卫星放量及军工反弹可期_page2_财务报表预测和估值数据汇总.jpg		"在2022年至2026年的五年间，陕西华达作为一家专注于电子元件和设备连接器的供应商，经历了显著的增长。从资产负债表中可以看出，公司的总资产从2022年的175.9亿元增长到2026年的332亿元，这主要得益于公司在商业卫星放量及军工反弹等领域的业务扩展。流动资产从2022年的134.7亿元增长到2026年的272.9亿元，表明公司在这段时间内积累了大量的现金和其他流动资产，为未来的投资和扩张提供了坚实的基础。

利润表显示，公司的营业收入从2022年的80.2亿元增长到2026年的136.9亿元，净利润也从2022年的6.5亿元增长到2026年的17.9亿元。这些数据反映了公司在市场需求和技术进步的推动下，实现了持续的盈利增长。特别是在2024年之后，公司的营业收入和净利润出现了显著的增长，这可能与公司在商业卫星放量及军工反弹等领域的成功布局有关。

然而，公司的负债也在逐年增加，从2022年的111亿元增长到2026年的149.1亿元。虽然负债的增加可能会对公司的财务状况产生一定的压力，但考虑到公司的总资产和盈利能力，这些负债似乎是可以承受的。此外，公司的EBITDA（息税折旧及摊销前利润）从2022年的12.8亿元增长到2026年的23.4亿元，显示出公司在控制成本和提高运营效率方面的努力。

现金流表显示，公司的经营活动现金流从2022年的-3.2亿元增长到2026年的3.6亿元，这表明公司在经营活动中产生的现金流量逐渐转正，为公司的持续发展提供了资金支持。同时，公司的投资活动现金流和筹资活动现金流也呈现出积极的趋势，表明公司在投资和融资方面取得了良好的进展。

总体来看，陕西华达在过去几年中取得了显著的增长，这主要得益于公司在市场需求和技术进步的推动下，成功地拓展了业务领域。然而，公司也需要关注负债的增加和全球经济形势的变化，以确保未来的可持续发展。"			2024E 年与 2022 年相比，存货增长了多少？	53%	60%	70%	80%	A
财务指标分析	fs	230955	data/figure/fs/2024-02-07--化学制品-硅宝科技-公司公告点评：2023年公司归母净利润同比增长25.9%_page3_财务报表分析和预测.jpg		"在2023年，硅宝科技公司迎来了一个重要的转折点。根据财务报表显示，公司在2023年的净利润同比增长了25.9%，达到了315百万元。这一显著的增长背后，是市场需求的强劲复苏和技术进步的推动。

首先，市场需求的回暖是驱动公司业绩增长的主要因素之一。随着全球经济形势的好转，化工制品行业的需求逐渐恢复。特别是在新能源和环保领域，对高性能材料的需求大幅增加。硅宝科技作为一家专注于化学制品研发和生产的公司，抓住了这一市场机遇，通过技术创新和产品升级，成功地满足了客户对高质量、高性能材料的需求。这不仅提高了公司的市场份额，也带动了销售额的快速增长。

其次，技术进步也是推动公司业绩增长的重要动力。硅宝科技一直致力于研发创新，不断推出具有竞争力的新产品。例如，在2023年，公司成功开发了一款新型高性能密封胶，该产品具有优异的耐候性和粘接性能，受到了市场的广泛认可。此外，公司还加大了对自动化生产线的投资，提高了生产效率和产品质量，进一步增强了公司的市场竞争力。

然而，市场竞争依然激烈。尽管硅宝科技在技术和产品上取得了显著优势，但行业内其他竞争对手也在不断加大研发投入，推出新产品。因此，公司需要持续关注市场动态，加强与客户的沟通，以保持其竞争优势。

宏观经济环境的变化也对公司财务表现产生了影响。政策变化、全球经济形势等因素都可能对公司的经营产生影响。例如，政府对新能源和环保领域的支持政策，为公司带来了新的发展机遇；而全球供应链的不稳定则可能导致原材料价格波动，增加公司的成本压力。

综上所述，硅宝科技在2023年取得了显著的业绩增长，这得益于市场需求的回暖和技术进步的推动。然而，市场竞争依然激烈，宏观经济环境的变化也可能对公司产生影响。未来，公司需要继续关注市场动态，加强技术创新，以保持其竞争优势并实现可持续发展。"			2023 年与 2024E 年相比，每股收益的差值是多少？	0.11	0.15	0.17	0.2	A
财务指标分析	fs	230965	data/figure/fs/2024-01-30--计算机设备-海康威视-Q4业绩超预期，呈现逐季改善趋势_page1_no_caption.jpg		"在2021年至2025年的五年间，海康威视的财务表现呈现出稳步增长的趋势。从资产负债表来看，公司的总资产从2021年的1038.65亿元增长到2025年的1702.56亿元，增长了近64%。其中，流动资产占比逐年增加，从2021年的86.02%增长到2025年的83.39%，表明公司对流动资金的管理能力不断增强。同时，非流动资产也有所增长，从2021年的178.45亿元增长到2025年的283.52亿元，显示出公司在固定资产和长期股权投资方面的持续投入。

利润表显示，海康威视的营业收入从2021年的814.20亿元增长到2025年的1157.11亿元，年均复合增长率达到了10.2%。净利润方面，从2021年的175.11亿元增长到2025年的215.26亿元，年均复合增长率达到了6.3%。这表明公司在保持收入快速增长的同时，也在不断提升盈利能力。

财务比率分析显示，海康威视的毛利率从2021年的44.33%下降到2025年的45.29%，净利率从2021年的21.51%下降到2025年的18.60%。这可能与市场竞争加剧、原材料成本上升等因素有关。然而，公司的ROE（净资产收益率）从2021年的26.47%增长到2025年的22.28%，表明公司股东权益回报率不断提高。

现金流量表显示，海康威视的经营活动现金流从2021年的127.09亿元增长到2025年的210.95亿元，年均复合增长率达到了11.5%。这表明公司在经营活动中的现金流入不断增加，为公司的持续发展提供了坚实的资金支持。

总体来看，海康威视在过去五年中取得了显著的财务增长，这主要得益于市场需求的持续增长和技术进步带来的产品创新。然而，市场竞争加剧和原材料成本上升等因素对公司盈利能力产生了一定影响。未来，随着全球经济形势的变化和政策环境的调整，海康威视需要进一步优化成本控制，提升产品竞争力，以应对市场挑战，实现可持续发展。"			2023E 年至 2025E 年期间，营业利润的增长幅度最大的一年是哪一年？	2023E 至 2024E	2024E 至 2025E	2022 至 2023E	2021 至 2022	B
财务指标分析	fs	231000	data/figure/fs/2023-12-18--证券-招商证券-公司季报点评：投行业务稳健，前三季度归母净利润同比微增_page3_表2招商证券资产负债表百万元.jpg		"在2021年至2025年的五年间，招商证券的资产负债表数据揭示了公司在市场环境、行业动态和经济趋势中的变化。从资产方面来看，货币资金从2021年的879.38亿元增长到2025年的1142.30亿元，这表明公司在资金管理上表现稳健，尤其是在客户资金存款和结算备付金方面，分别从781.61亿元和258.73亿元增长到876.75亿元和379.43亿元。这些数据反映了公司在金融服务领域的持续扩张和客户信任度的提升。

交易性金融资产是公司资产的重要组成部分，从2021年的2653.44亿元增长到2025年的2666.34亿元，显示出公司在金融市场上的活跃度和投资策略的有效性。融出资金和买入返售金融资产也呈现出稳步增长的趋势，分别从986.87亿元和391.99亿元增长到899.25亿元和546.78亿元，这表明公司在融资业务和资产管理方面的竞争力不断增强。

负债方面，短期借款和卖出回购金融资产款是主要的负债项目，分别从524.8亿元和1274.18亿元增长到1228.1亿元和1244.66亿元。这反映了公司在资金运作上的灵活性和对流动性的有效管理。代理买卖证券款从996.05亿元增长到1231.45亿元，显示出公司在证券经纪业务上的强劲表现。

所有者权益方面，归属于母公司所有者权益合计从1125.03亿元增长到1392.69亿元，这表明公司在股东回报方面的表现良好。资本公积和盈余公积的增长也反映了公司在财务健康方面的稳定发展。

总体来看，招商证券在过去五年中表现出稳健的财务状况和良好的市场表现。公司的资产规模不断扩大，负债结构合理，所有者权益稳步增长。这些变化背后的主要驱动因素包括市场需求的增加、技术进步带来的服务创新以及公司在金融服务领域的持续拓展。然而，外部因素如政策变化、市场竞争和全球经济形势也可能对公司财务表现产生影响。例如，政策变化可能会影响公司的融资成本和业务范围，市场竞争加剧可能导致利润率下降，全球经济形势的变化则可能影响公司的国际业务和投资决策。因此，招商证券需要密切关注这些外部因素，并采取相应的策略来应对未来的挑战。"			2025E 年的总资产中，交易性金融资产的占比是多少？	39.80%	40.60%	41.20%	42.10%	B
财务指标分析	fs	231016	data/figure/fs/2023-12-03--旅游酒店-锦江酒店-收购锦江国际酒管公司，推进高端品牌资源整合_page2_一公司财务预测表.jpg		"在一个充满挑战与机遇的市场环境中，锦江酒店集团正经历着前所未有的转型与发展。根据最新的财务预测表显示，从2022年到2025年，锦江酒店的营业收入预计将从110.076亿元增长至174.449亿元，净利润也将从245.13亿元增长至2914.04亿元。这些数据背后，不仅反映了锦江酒店在高端品牌资源整合方面的成功，更体现了整个酒店行业在市场需求和技术进步驱动下的蓬勃发展。

首先，市场需求是推动锦江酒店业绩增长的重要因素之一。随着全球经济的复苏和旅游业的回暖，人们对高品质住宿体验的需求日益增加。特别是在后疫情时代，消费者更加注重健康与安全，对高端酒店品牌的需求显著提升。锦江酒店通过收购国际酒管公司，进一步提升了其在全球市场的竞争力，满足了这一市场需求。

其次，技术进步也为锦江酒店的发展提供了强大动力。近年来，锦江酒店不断加大在数字化转型方面的投入，利用大数据、人工智能等先进技术优化运营效率，提升客户体验。例如，通过智能客房管理系统，锦江酒店能够实现对客房状态的实时监控和管理，有效降低运营成本；同时，通过数据分析，精准把握客户需求，提供个性化服务，从而提高客户满意度和忠诚度。

然而，在看到积极趋势的同时，我们也必须关注可能影响公司财务表现的外部因素。政策变化、市场竞争以及全球经济形势都是不可忽视的风险点。例如，政府对房地产市场的调控政策可能会对酒店业产生一定影响；此外，随着越来越多的竞争对手进入高端酒店市场，锦江酒店需要不断创新和提升服务质量，以保持竞争优势。全球经济增长放缓也可能导致旅游需求减少，进而影响酒店业的整体表现。

综上所述，尽管面临诸多挑战，但凭借强大的市场需求、先进的技术支撑以及有效的战略规划，锦江酒店有望在未来几年内继续保持稳健增长，并引领整个酒店行业迈向新的高度。"			2025E 年的营业利润与营业收入的比例是多少？	18.40%	20.60%	22.30%	24.70%	B
财务指标分析	sdt	231039	data/figure/sdt/2024-09-22--航运港口-中远海能-全球油气航运龙头，油运上行凸显价值_page18_图表38中远海能估值模型核心假设.jpg		"在2024年至2026年的预测期内，中远海能作为全球油气航运的龙头，展现了强劲的增长势头。从图表中可以看出，公司的营业收入预计从2024年的263.66亿元增长到2026年的296.65亿元，年均复合增长率约为6.1%。这一增长主要得益于油品运输和LNG运输业务的持续扩张。

首先，油品运输业务是公司收入的主要来源，预计从2024年的244.36亿元增长到2026年的274.76亿元，年均复合增长率约为5.6%。这背后的主要驱动因素是全球能源需求的稳步增长，特别是在亚洲和欧洲市场。随着全球经济的复苏，工业生产和消费活动的增加推动了对石油和成品油的需求。此外，技术进步和效率提升也使得公司在竞争激烈的市场中保持领先地位。

LNG运输业务同样表现出色，预计从2024年的18.39亿元增长到2026年的21.11亿元，年均复合增长率约为13.6%。这一快速增长的背后是全球对清洁能源需求的增加，尤其是在中国和印度等新兴市场。随着各国政府加大对可再生能源的投资和支持政策，LNG作为一种清洁、高效的能源形式，市场需求将持续增长。同时，公司在LNG运输领域的技术和运营能力不断提升，进一步巩固了其市场地位。

然而，值得注意的是，其他业务的表现相对疲软，预计从2024年的0.91亿元下降到2026年的0.78亿元，年均复合增长率为-2.3%。这可能与市场竞争加剧和宏观经济环境的变化有关。在全球经济形势不确定的情况下，一些非核心业务可能会面临更大的挑战。

总体来看，中远海能在未来几年内有望继续保持稳健的增长态势。尽管面临一些外部挑战，但公司在核心业务领域的竞争优势和技术实力为其提供了坚实的基础。随着全球能源需求的持续增长和技术进步的推动，中远海能有望在未来实现更加辉煌的业绩表现。"			2025年LNG运输业务的营业收入预计为18.58亿元，相比2024年的增长率是多少？	1.00%	13.63%	1.19%	28.18%	C
财务指标分析	sdt	231045	data/figure/sdt/2024-09-17--化学制品-一诺威-北交所公司深度报告：聚氨酯CPU全国单项冠军，技术+产业链共建竞争优势_page17_表132023年聚氨酯上游原材料大幅扩产.jpg		"在2024年9月17日发布的化学制品行业深度报告中，聚氨酯CPU全国单项冠军——诺威-北交所公司展示了其在技术与产业链共建方面的竞争优势。从图表中可以看出，环氧丙烷的产能增速高达40.44%，产量增速为11.49%，进口量增速为15.06%，但出口量增速却大幅下降至-57.63%。这表明尽管国内生产规模迅速扩大，但由于国际市场需求疲软，导致出口受阻。

聚醚多元醇的产能增速仅为2.01%，但产量增速达到10.03%，进口量增速为-19.08%，出口量增速为17.60%。这可能是因为国内市场对聚醚多元醇的需求增加，而国外市场则相对饱和。TDI的产能增速为13.71%，产量增速为12.68%，进口量增速为-34.15%，出口量增速为1.74%。这表明TDI在国内市场的供需关系较为平衡，但在国际市场上的竞争力较弱。

聚合MDI和纯MDI的产能增速均为0%，但产量增速分别为8.57%和8.57%，进口量增速分别为9.99%和25%，出口量增速分别为9.28%和3.03%。这表明这两种产品在国内市场的供应稳定，且出口需求有所增长。

BDQ的产能增速为35.34%，产量增速为18.13%，进口量增速为-50.67%，出口量增速为150%。这表明BDQ在国内市场的生产规模迅速扩大，且出口需求强劲。己二酸的产能增速为13.68%，产量增速为13.68%，进口量增速为-3.57%，出口量增速为12.00%。这表明己二酸在国内市场的供需关系较为平衡，且出口需求有所增长。

新戊二醇的产能增速为22.8%，产量增速为11.3%，进口量增速为-10.2%，出口量增速为41.2%。这表明新戊二醇在国内市场的生产规模迅速扩大，且出口需求强劲。丙二醇的产能增速为7.93%，产量增速为13.76%，进口量增速为-6.69%，出口量增速为6.31%。这表明丙二醇在国内市场的生产规模稳步增长，且出口需求有所增长。

碳酸二甲酯的产能增速为26.85%，产量增速为21.5%，出口量增速为18.42%。这表明碳酸二甲酯在国内市场的生产规模迅速扩大，且出口需求强劲。

总体来看，这些数据反映了化学制品行业在国内外市场上的供需关系、竞争格局和技术进步等方面的变化趋势。在全球经济形势复杂多变的背景下，政策变化、市场竞争和技术进步等因素将对公司的财务表现产生重要影响。因此，企业需要密切关注市场动态，及时调整战略，以应对各种挑战和机遇。"			根据表格数据，环氧丙烷的产能增速为40.44%，产量增速为11.49%，进口量增速为15.06%，出口量增速为-57.63%。请问环氧丙烷的出口量增速与进口量增速之差是多少？	-72.69%	-42.57%	-72.63%	-42.59%	A
财务指标分析	sdt	231129	data/figure/sdt/2024-07-14--电子化学品-金宏气体-公司深度报告：综合气体服务商，打造电子大宗现场制气新增长极_page27_表18金宏气体相较于可比公司20242026年具备估值提升空间.jpg		"在2024年7月14日发布的电子化学品行业深度报告中，金宏气体作为一家综合气体服务商，展现了其在电子大宗现场制气领域的强劲增长潜力。报告详细对比了金宏气体与广钢气体、杭氧股份和中船特气等竞争对手的财务表现，揭示了该行业未来几年的发展趋势。

首先，从最新市值来看，广钢气体以11703.1亿元遥遥领先，其次是杭氧股份（19059.4亿元）和中船特气（15771.2亿元），而金宏气体则为8680.2亿元。尽管金宏气体的市值相对较低，但其归母净利润却表现出强劲的增长势头。从2023年的315.0百万元增长到2026年的624.7百万元，年复合增长率高达25%以上。相比之下，广钢气体和杭氧股份的归母净利润增速分别为11%和13%，显示出金宏气体在市场中的竞争优势。

进一步分析PE（市盈率）数据，可以发现金宏气体的PE值从2023年的27.6下降到2026年的13.9，表明市场对其未来盈利预期持乐观态度。与此同时，广钢气体和杭氧股份的PE值也呈现下降趋势，但降幅较小，显示出投资者对这些公司的信心有所减弱。

驱动金宏气体业绩增长的主要因素包括市场需求的持续增长和技术进步。随着电子行业的发展，对高质量气体的需求不断增加，推动了金宏气体的业务扩张。此外，公司在技术创新方面的投入也为其带来了显著的竞争优势。例如，金宏气体开发了一种新型高效气体分离技术，能够显著降低生产成本并提高产品质量，从而吸引了更多客户。

然而，市场竞争激烈和全球经济形势的变化也可能对金宏气体的财务表现产生影响。目前，全球经济增长放缓，贸易保护主义抬头，这可能会导致市场需求减少。同时，行业内其他公司也在加大研发投入，试图抢占市场份额。因此，金宏气体需要不断创新，提升自身竞争力，才能在激烈的竞争中保持领先地位。

综上所述，尽管面临诸多挑战，但凭借其强大的技术实力和不断增长的市场需求，金宏气体有望在未来几年实现持续增长，并成为电子化学品行业的领军企业之一。"			金宏气体在2024年至2026年的预测归母净利润增长率分别是多少？请选出正确的选项。	20%、25%、20%	25%、20%、25%	20%、20%、25%	25%、25%、20%	A
财务指标分析	sdt	231145	data/figure/sdt/2024-06-28--农牧饲渔-邦基科技-高端饲料领航者，有望充分受益后周期需求回暖_page10_图表14部分生猪上市公司资产负债率.jpg		"在2018年至2024年的这段时间里，中国生猪上市公司的资产负债率经历了显著的变化。从图表中可以看出，大多数公司在2018年到2020年间资产负债率相对稳定，但自2021年起，这一指标开始出现明显波动。以牧原股份为例，其资产负债率从2018年的54%上升至2021年的61%，随后在2022年回落至54%，并在2023年和2024年进一步上升至62%和64%。这种变化趋势反映了市场环境的复杂性和行业动态的快速变化。

首先，市场需求是驱动这些变化的重要因素之一。随着消费者对猪肉需求的增加，生猪养殖企业需要扩大生产规模以满足市场需求，这导致了负债率的上升。然而，由于市场竞争激烈，部分企业在扩张过程中面临资金压力，从而导致资产负债率的波动。例如，*ST正邦在2021年和2022年的资产负债率分别高达93%和148%，这可能是由于过度扩张和市场风险导致的资金链紧张。

其次，技术进步也在一定程度上影响了企业的财务表现。随着智能化养殖技术的应用，一些企业能够提高生产效率，降低运营成本，从而改善财务状况。例如，新希望的资产负债率从2018年的43%上升至2021年的65%，但在2022年和2023年分别下降至68%和72%，这可能得益于其在智能化养殖方面的投资和技术升级。

此外，宏观经济和政策变化也对生猪养殖行业产生了重要影响。近年来，中国政府出台了一系列支持农业发展的政策措施，包括补贴、贷款优惠等，这有助于缓解企业的资金压力。然而，全球经济形势的不确定性以及国际贸易摩擦等因素也可能对行业产生负面影响。例如，天康生物的资产负债率在2021年达到55%，但在2022年和2023年分别降至50%和53%，这可能是由于其成功应对了外部环境的挑战，并通过优化管理提高了盈利能力。

综上所述，中国生猪上市公司的资产负债率变化反映了市场需求、技术进步、宏观经济和政策变化等多种因素的综合作用。未来，随着市场环境的不断变化和行业竞争的加剧，这些企业需要继续加强风险管理，提升核心竞争力，以应对各种挑战并实现可持续发展。"			根据图表，哪一家公司在2024年3月31日的资产负债率最高？	新希望	傲农生物	*ST正邦	天康生物	B
